date,tweet,time,neg,neu,pos,compound
2021-02-03,new figures show that more than hong kongers received resident permits in taiwan in nearly double the number who relocated to the prior year ,15:54:03,0.0,0.947,0.053,0.0772
2021-02-03,indegene a bangalore based global healthcare solutions company has received million of funding from carlyle group and brighton park capital ,15:51:06,0.0,0.914,0.086,0.1779
2021-02-03,new ether cryptocurrency futures could put at risk a record run in prices ,15:48:03,0.16,0.84,0.0,-0.2732
2021-02-03,the u s has filed court documents in a bid to seize oil on board a vessel because it says the crude came from iran and falls under its terrorism laws ,15:48:03,0.433,0.567,0.0,-0.9694
2021-02-03,boeing is biggest x customer is weighing whether to swap as many as a third of its orders for the smaller dreamliner ,15:47:03,0.0,1.0,0.0,0.0
2021-02-03,spain is largest bank takes a billion charge in the fourth quarter to reflect job cuts and branch closures ,15:47:02,0.115,0.885,0.0,-0.296
2021-02-03,britons are guzzling the australian wine that should have gone to china ,15:42:02,0.0,1.0,0.0,0.0
2021-02-03,foster farms is providing of its poultry workers in california with the coronavirus vaccine ,15:38:04,0.0,1.0,0.0,0.0
2021-02-03,hungarian low cost airline wizz air wants to push hard in western europe but is stifled by entrenched rivals ,15:37:04,0.268,0.732,0.0,-0.5927
2021-02-03,porsche is increasing spending to bolster the digital products and services that supplement its luxury sports cars to lure more tech savvy customers particularly in china ,15:35:01,0.0,1.0,0.0,0.0
2021-02-03,mario draghi will likely be given the unenviable task today of forming a new government in italy and more in today is brussels edition ,15:31:05,0.0,1.0,0.0,0.0
2021-02-03, why aren t we talking about this farmersprotest rihanna tweeted to her more than million followers ,15:31:04,0.0,1.0,0.0,0.0
2021-02-03,sony corp raised its annual operating income outlook by after reporting stronger than expected holiday quarter earnings ,15:30:12,0.0,0.739,0.261,0.6486
2021-02-03,the philippines has signed a preliminary deal with moderna to supply its coronavirus vaccines to the southeast asian nation with a final agreement likely this month ,15:21:03,0.0,0.878,0.122,0.4939
2021-02-03,parts of britain are already hitting their carbon targets ,15:18:06,0.0,1.0,0.0,0.0
2021-02-03,what you need to know about section and how it became the center of the fight over online speech ,15:03:06,0.126,0.874,0.0,-0.3818
2021-02-03,the future of london as a global financial hub hangs on difficult brexit talks with an unsympathetic eu via bw,15:03:05,0.122,0.878,0.0,-0.3612
2021-02-03,siemens ceo joe kaeser discusses the outlook for europe is biggest engineering company and the impact of the latest virus surge ,15:02:58,0.0,1.0,0.0,0.0
2021-02-03,consider this valentine s day an opportunity to share a new love language with your sweethearts ,14:58:06,0.0,0.435,0.565,0.9186
2021-02-03,kuwait s rating outlook was cut to negative from stable at fitch as political bickering delays reforms and stymies borrowing ,14:53:02,0.242,0.667,0.092,-0.5574
2021-02-03,the reddit storm calms mario draghi is set for a return and jeff bezos takes a step back what to watch on wednesday ,14:49:24,0.0,0.897,0.103,0.3182
2021-02-03,astrazeneca s covid vaccine showed effectiveness with a three month gap between two shots the maximum dosing interval approved in the u k ,14:45:06,0.0,0.865,0.135,0.4215
2021-02-03,turkish inflation likely quickened for a fourth month on last year s lira downswing and a rise in international commodity prices ,14:41:07,0.0,0.63,0.37,0.9186
2021-02-03,jeff bezos steps down at amazon after years of leading the company through perhaps the most fertile period of any american business ever ,14:40:35,0.0,0.928,0.072,0.1779
2021-02-03,viruses mutate all the time including the novel coronavirus that s caused the global pandemic but recent variants that have emerged in the u k south africa and brazil are causing particular concern ,14:39:06,0.0,0.946,0.054,0.1655
2021-02-03,south korea returned to first place in the latest bloomberg innovation index while the u s dropped out of the top ,14:37:01,0.0,0.794,0.206,0.5267
2021-02-03,more than cruise fanatics have volunteered to test covid protocols aboard ships ,14:36:41,0.0,0.909,0.091,0.0258
2021-02-03,singapore passed legislation that will allow the government to use covid tracing data in certain criminal investigations ,14:36:06,0.159,0.654,0.187,-0.1027
2021-02-03,uae job market sees growth for the first time in over a year ,14:23:03,0.0,0.809,0.191,0.3818
2021-02-03,dubai stocks are more out of step with their emerging market peers than they ve been in more than two years thanks to the city is battering for tourism and retail shares ,14:22:02,0.0,0.855,0.145,0.6249
2021-02-03,starzplay a middle eastern competitor of netflix got million in debt financing from an abu dhabi based fund as the pandemic fuels demand for home entertainment ,14:21:08,0.139,0.764,0.097,-0.0516
2021-02-03,eu faces billion euro price tag for bungled vaccine rollout ,14:21:08,0.0,1.0,0.0,0.0
2021-02-03,india s plan to spend its way out of the coronavirus funk is capturing the imagination of stock watchers ,14:19:03,0.0,1.0,0.0,0.0
2021-02-03,bill gates and the world s rich are winning big on private jet firm s surge ,14:19:03,0.0,0.632,0.368,0.7906
2021-02-03,more than cruise fanatics have volunteered to test covid protocols aboard ships ,14:18:02,0.0,0.909,0.091,0.0258
2021-02-03, coronavirus latest global cases top million deaths surpass million who team visits the wuhan lab that s been at the center of months of speculation over how the disease jumped to humans new zealand approves pfizer biontech vaccine ,14:13:48,0.0,0.886,0.114,0.5423
2021-02-03,jeff bezos is stepping down as ceo of amazon later this year and transitioning to the role of executive chairman bradstone explains what may be behind the move ,14:12:05,0.0,0.941,0.059,0.1779
2021-02-03,here is how to make a billion business from online gift giving ,14:11:05,0.0,0.629,0.371,0.6486
2021-02-03,india s bad bank sparks concern loan prices could be inflated ,14:10:06,0.28,0.72,0.0,-0.5423
2021-02-03, u s futures japan australia stocks rise hong kong stocks silver futures oil climbs to ,13:48:25,0.0,0.545,0.455,0.9186
2021-02-03,the thai resort island of phuket is drawing up plans to fully reopen to vaccinated visitors by october to revive its wrecked tourism industry ,13:46:04,0.0,0.906,0.094,0.34
2021-02-03,why disney fans have their post pandemic sights set on japan ,13:39:31,0.0,1.0,0.0,0.0
2021-02-03,silver climbed back up after posting the biggest loss since august with markets calming following the buying frenzy this week ,13:18:04,0.384,0.531,0.084,-0.9118
2021-02-03,spacex is starship prototype rocket exploded during a landing attempt it flew about miles high and crashed near its launch pad in boca chica texas ,13:12:06,0.0,1.0,0.0,0.0
2021-02-03,amazon s incoming ceo andy jassy is arguably the most important person in tech over the past decade and uncannily similar to jeff bezos ,13:08:01,0.078,0.775,0.147,0.2006
2021-02-03,south korean president moon jae in is calling on the corporate winners of the pandemic to share some of their profits with smaller businesses that have borne the brunt of the economic pain ,13:07:07,0.081,0.716,0.202,0.5994
2021-02-03,oil extended gains in asia after closing at the highest level in more than a year as declines in u s and chinese crude stockpiles gave fresh impetus to a rally driven by tightening global supplies ,13:01:04,0.295,0.603,0.101,-0.9186
2021-02-03,morgan stanley is former india head is looking for tech targets for his spac among firms connected to the u s is indian diaspora ,13:01:04,0.0,1.0,0.0,0.0
2021-02-03,who team visits the wuhan laboratory at the center of months of speculation over how the disease jumped to humans ,13:01:04,0.0,1.0,0.0,0.0
2021-02-03,blackstone group is in exclusive talks to acquire japanese skincare brand fancl s asia business outside its home country sources say ,13:00:05,0.0,0.927,0.073,0.128
2021-02-03,putting in extra hours at home you are not alone ,12:58:03,0.0,0.838,0.162,0.1877
2021-02-03,with economies hit by covid two japanese fishing villages are eyeing the potential investment from hosting the nation s atomic waste ,12:45:09,0.128,0.872,0.0,-0.4215
2021-02-03,reserve bank chief philip lowe praises australia s quantitative easing program and warns it would be premature to consider withdrawing monetary stimulus when global peers had just extended it ,12:39:05,0.043,0.743,0.214,0.6705
2021-02-03,china s largest carbon capture project completes construction ,12:37:02,0.0,1.0,0.0,0.0
2021-02-03,jeff bezos walked through a one way door and opened a new age for amazon bradstone writes ,12:37:02,0.0,0.892,0.108,0.1779
2021-02-03,a second chinese lawyer who represented a hong kong pro democracy activist was stripped of his license ap reports ap,12:36:01,0.0,1.0,0.0,0.0
2021-02-03,emerging market stocks may have already peaked for the year according to morgan stanley ,12:34:05,0.0,1.0,0.0,0.0
2021-02-03,how china is liquidity squeeze got markets all rattled ,12:34:05,0.0,1.0,0.0,0.0
2021-02-03,new zealand s unemployment rate unexpectedly dropped in the fourth quarter ,12:34:04,0.244,0.756,0.0,-0.4404
2021-02-03,rihanna and greta thunberg draw global attention to indian farmers fight against the government s new agriculture laws ,12:13:05,0.14,0.86,0.0,-0.3818
2021-02-03,alibaba will kick off what could be a billion dollar bond sale this week picking up a plan that went quiet when jack ma went out of sight for months ,12:04:04,0.0,1.0,0.0,0.0
2021-02-03,biden visits capitol where officer killed in jan riot lies in honor ,12:03:07,0.493,0.362,0.145,-0.8271
2021-02-03,the use of the bharat biotech shot has drawn particular ire because pm modi s government has distributed it alongside astrazeneca s inoculation which completed final tests ,11:39:03,0.0,1.0,0.0,0.0
2021-02-03,the use of the bharat biotech shot has drawn particular ire because pm modi s government has distributed it alongside astrazeneca s inoculation which completed final tests ,11:38:03,0.0,1.0,0.0,0.0
2021-02-03,thailand is reviving its use of one of the harshest laws in the world which criminalizes royal insults as street protests linger ,11:35:02,0.312,0.688,0.0,-0.8225
2021-02-03,a pandemic fueled boom in online shopping led ups to post record sales last year but it also increased the courier s dependence on amazon ,11:28:05,0.0,0.817,0.183,0.5719
2021-02-03,boustead holdings plunged by the most in years after its major shareholder abandoned an offer to take the malaysian conglomerate private ,11:16:07,0.13,0.87,0.0,-0.4588
2021-02-03,kwok hiu ting the daughter of kaisa group chairman has agreed to buy the controlling stake in major hong kong media firm sing tao news for about million ,11:16:06,0.0,0.682,0.318,0.9337
2021-02-03,china is stockpiling computer chips and the machines that make them to protect itself from a widening u s technology ban ,11:13:40,0.162,0.721,0.117,-0.25
2021-02-03,latest shares of kia motors jumped as much as after a local media reported that apple will invest billion as part of a collaboration with the south korean carmaker on making electric vehicles more ,10:51:08,0.115,0.824,0.06,-0.4588
2021-02-03,just in treasury secretary janet yellen has summoned u s financial regulators to discuss recent volatility in financial markets ,10:46:05,0.0,0.899,0.101,0.2023
2021-02-03,breaking the family office of google co founder sergey brin is setting up a branch in singapore joining the rush of uber wealthy clans toward the southeast asian financial hub ,10:40:58,0.0,0.909,0.091,0.4201
2021-02-03,asia s online broker stocks hit jackpot in global retail mania ,10:39:05,0.0,1.0,0.0,0.0
2021-02-03,the meme stocks that robinhood originally restricted have lost billion in a matter of days and there s little sign the pain is easing ,10:37:07,0.283,0.606,0.111,-0.7037
2021-02-03,tencent fires over employees after year long graft probe ,10:34:06,0.0,1.0,0.0,0.0
2021-02-03,jeff bezos is stepping down as ceo of amazon later this year and transitioning to the role of executive chairman bradstone explains what may be behind the move ,10:33:45,0.0,0.941,0.059,0.1779
2021-02-03,brexit and pandemic double whammy hit ireland at start of ,10:32:02,0.0,1.0,0.0,0.0
2021-02-03,impossible foods cuts its suggested retail prices by at u s grocery stores ,10:30:08,0.18,0.82,0.0,-0.296
2021-02-03, new zealand unemployment unexpectedly dropped last quarter former ecb chief draghi tapped to lead italy out of its crisis and myanmar army s next problem defeating suu kyi in an election here s the latest news and analysis from bloomberg economics ,10:13:02,0.26,0.74,0.0,-0.9062
2021-02-03,global lng imports fell for the third straight month amid shipping restraints and lackluster european demand ,10:12:06,0.086,0.805,0.109,0.1027
2021-02-03,jeff bezos will step down as ceo of amazon later this year and transition to the role of executive chairman ,10:11:05,0.0,0.918,0.082,0.1779
2021-02-03,spacex is starship prototype rocket exploded during a landing attempt it flew about miles high and crashed near its launch pad in boca chica texas ,10:10:17,0.0,1.0,0.0,0.0
2021-02-03,now that myanmar s generals have ousted aung san suu kyi they must figure out how to beat her in an election ,10:07:03,0.0,1.0,0.0,0.0
2021-02-03,apple to invest billion in kia to make electric vehicles donga newspaper says ,10:04:29,0.259,0.741,0.0,-0.6369
2021-02-03,gamestop frenzy is lost in translation for japan s day traders ,10:02:04,0.365,0.635,0.0,-0.5574
2021-02-03,kuwait wealth fund commits to london even as it sues ex managers ,09:56:03,0.0,0.699,0.301,0.5106
2021-02-03,u k seeks views on new post brexit subsidies system ,09:47:07,0.0,1.0,0.0,0.0
2021-02-03,pelosi steps up security for traveling members of congress ,09:47:06,0.0,0.769,0.231,0.34
2021-02-03,ree automotive an israeli electric vehicle technology startup has agreed to go public through a merger with a blank check company ,09:39:04,0.0,0.896,0.104,0.2732
2021-02-03,latest new zealand s medicines regulator has approved the pfizer biontech vaccine for domestic use once it arrives in the country ,09:31:43,0.0,0.872,0.128,0.4215
2021-02-03,nigeria s currency weakened even after authorities threatened to cut the banking services of exporters who fail to repatriate their dollars ,09:29:05,0.405,0.595,0.0,-0.872
2021-02-03,independence would hurt scotland more than brexit lse says ,09:29:05,0.298,0.702,0.0,-0.5267
2021-02-03, bezos hands amazon reins to head of cloud computing meme stocks lose billion after reddit mania alibaba posts strong sales here are some of the things you need to know at the start of asia is trading day ,09:28:12,0.2,0.7,0.1,-0.8402
2021-02-03,the world bank has suspended a million payment to support the democratic republic of congo s education system amid an investigation into fraud and misuse of public funds in the sector ,09:27:06,0.194,0.73,0.076,-0.6369
2021-02-03,indian supply chain startup zetwerk raises million ,09:26:01,0.0,1.0,0.0,0.0
2021-02-03,parts of britain are already hitting their carbon targets ,09:18:06,0.0,1.0,0.0,0.0
2021-02-03,elon musk keeps sparring with regulators as biden is cabinet takes the reins ,09:13:01,0.0,1.0,0.0,0.0
2021-02-03,u s mines produced around billion less in minerals in than the year before ,09:12:07,0.0,1.0,0.0,0.0
2021-02-03,batteries solar panels and electric cars are spawning more giant fortunes ,09:05:01,0.0,1.0,0.0,0.0
2021-02-03,five things you need to know at the start of asia is trading day ,08:59:06,0.0,1.0,0.0,0.0
2021-02-03,evening briefing amazon ceo jeff bezos the world s richest person will step down from his post ,08:54:04,0.0,0.733,0.267,0.6249
2021-02-03,what you need to know about section and how it became the center of the fight over online speech ,08:54:04,0.126,0.874,0.0,-0.3818
2021-02-03,new south korea returned to first place in the latest bloomberg innovation index while the u s dropped out of the top ,08:47:10,0.0,0.804,0.196,0.5267
2021-02-03,singapore passed legislation that will allow the government to use covid tracing data in certain criminal investigations ,08:40:11,0.159,0.654,0.187,-0.1027
2021-02-03,citigroup is incoming ceo jane fraser created a new global operating team aimed at improving accountability among its top executives ,08:33:05,0.0,0.708,0.292,0.6808
2021-02-03, the e commerce site for high end goods and art has tapped banks to lead an initial public offering this year ,08:30:09,0.0,1.0,0.0,0.0
2021-02-03,jeffrey epstein s estate in the u s virgin islands has paid almost million to settle claims by women who accused him of sexual assault ,08:24:05,0.231,0.769,0.0,-0.7184
2021-02-03,new zealand s unemployment rate unexpectedly dropped in the fourth quarter ,08:10:05,0.244,0.756,0.0,-0.4404
2021-02-03,katherine tai joe biden s nominee for u s trade representative has chosen a lawyer from the senate committee responsible for trade to serve as her general counsel ,08:07:08,0.0,0.909,0.091,0.3182
2021-02-03,foster farms is providing of its poultry workers in california with the coronavirus vaccine ,08:03:05,0.0,1.0,0.0,0.0
2021-02-03,andy jassy is not as famous as some silicon valley entrepreneurs but for much of the last decade he s been arguably the most important person in the tech industry ,08:02:03,0.078,0.84,0.082,0.036
2021-02-03,alibaba will kick off what could be a billion dollar bond sale this week picking up a plan that went quiet when jack ma went out of sight for months ,07:59:04,0.0,1.0,0.0,0.0
2021-02-03,mcdonald s can go forward with its lawsuit to claw back million in stock from former ceo steve easterbrook ,07:55:05,0.101,0.899,0.0,-0.2263
2021-02-03,match gave a forecast for revenue growth this year reflecting the toll of nearly a year of social distancing has taking on the dating scene ,07:50:05,0.0,0.894,0.106,0.3818
2021-02-03,bp isn t yet turning a profit on its car charging stations but expects that to change as more electric vehicles come onto market ,07:44:02,0.0,0.792,0.208,0.7579
2021-02-03,biden administration will test a program to provide coronavirus vaccines directly to pharmacies ,07:40:06,0.0,1.0,0.0,0.0
2021-02-03,cities are undercounting their co by nearly ,07:37:03,0.0,1.0,0.0,0.0
2021-02-03,jeff bezos is worth billion the highest his fortune has been this year ,07:28:04,0.0,0.863,0.137,0.2263
2021-02-03,biden orders a review and possible repeal of trump era policies intended to deter illegal migration at the u s mexico border ,07:28:04,0.167,0.833,0.0,-0.5574
2021-02-03,the thai resort island of phuket is drawing up plans to fully reopen to vaccinated visitors by october to revive its wrecked tourism industry ,07:28:03,0.0,0.906,0.094,0.34
2021-02-03,south korean president moon jae in is calling on the corporate winners of the pandemic to share some of their profits with smaller businesses that have borne the brunt of the economic pain ,07:22:08,0.081,0.716,0.202,0.5994
2021-02-03,young leveraged traders have become a powerful force in south korea is stock market ,07:17:06,0.0,0.811,0.189,0.4215
2021-02-03,pg amp e sold the rights to put wireless telecom antennas on its towers to a subsidiary for million ,07:12:09,0.0,1.0,0.0,0.0
2021-02-03,with economies hit by covid two japanese fishing villages are eyeing the potential investment from hosting the nation s atomic waste ,07:04:06,0.128,0.872,0.0,-0.4215
2021-02-03,thailand s central bank will likely hold its key interest rate steady at an all time low and let fiscal policy take the lead in reviving the economy ,06:57:05,0.07,0.831,0.1,0.2263
2021-02-03,suspected chinese hackers broke into u s government computers last year by exploiting another flaw in software made by solarwinds reuters reports ,06:52:05,0.309,0.691,0.0,-0.765
2021-02-03,california governor gavin newsom s support among voters is slipping according to a new poll ,06:51:00,0.0,0.816,0.184,0.4019
2021-02-03, it was a social experiment it most certainly was not a smart investment ,06:50:08,0.162,0.645,0.193,0.1116
2021-02-03,alphabet said its google cloud business had an operating loss of billion in the fourth quarter ,06:47:05,0.4,0.6,0.0,-0.9186
2021-02-03,a few hedge funds were walloped by double digit losses but the industry s january numbers show most funds got through the chaos with only minor damage ,06:42:06,0.337,0.663,0.0,-0.9042
2021-02-03,sorting out who is a bot and who is not isn t simple ,06:38:02,0.0,1.0,0.0,0.0
2021-02-03,the biden administration is looking at adding several veterans of global financial diplomacy to its ranks ,06:37:07,0.0,1.0,0.0,0.0
2021-02-03,the transition plan for jeff bezos arrives at time when amazon seems unstoppable fueled by record sales amid the pandemic and generating massive profits from amazon web services which andy jassy helped create ,06:37:05,0.047,0.733,0.22,0.6808
2021-02-03,senate democrats put biden s trillion stimulus plan on a fast track to passage ,06:34:04,0.0,1.0,0.0,0.0
2021-02-03,a fragile recovery in asian aviation is being snuffed out by a resurgence of covid in the region ,06:32:06,0.0,1.0,0.0,0.0
2021-02-03,biden will order a government wide review of critical supply chains in an effort to reduce u s reliance on other countries for essential medical supplies and minerals ,06:27:03,0.087,0.913,0.0,-0.3182
2021-02-03,electronic arts fell in extended trading after the video game maker s forecast for fourth quarter profit fell short of analysts estimates ,06:25:05,0.0,0.667,0.333,0.9186
2021-02-03,chipotle reported fourth quarter sales that trailed estimates as a resurgence of covid infections in the u s limited gains ,06:22:04,0.098,0.777,0.124,0.128
2021-02-03,amgen maker of the blockbuster arthritis treatment enbrel saw an increase in product sales in the fourth quarter of ,06:19:07,0.0,0.733,0.267,0.7351
2021-02-03,now that myanmar s generals have ousted aung san suu kyi they must figure out how to beat her in an election ,06:17:03,0.0,1.0,0.0,0.0
2021-02-03,alphabet reported quarterly sales that beat estimates buoyed by heavy digital advertising spending during the holiday shopping quarter ,06:14:06,0.0,0.863,0.137,0.4019
2021-02-03,after thai king maha vajiralongkorn took the throne in he instructed the government to stop using a controversial law criminalizing royal insults yet after months of protests authorities are again ramping up use of the law ,06:10:08,0.219,0.781,0.0,-0.7717
2021-02-03,china is stockpiling computer chips and the machines that make them to protect itself from a widening u s technology ban ,06:05:09,0.162,0.721,0.117,-0.25
2021-02-03,new here is the full letter jeff bezos wrote to amazon employees upon stepping aside as ceo ,06:04:37,0.0,0.904,0.096,0.1779
2021-02-03,amazon forecast first quarter sales that topped analysts estimates signaling the internet shopping boom will continue ,06:04:02,0.0,0.898,0.102,0.1779
2021-02-03,the who is waffling over covid vaccines and pregnancy stems from a bigger problem the failure to study this group via bopinion,06:02:03,0.24,0.76,0.0,-0.7184
2021-02-03,creditors of argentina s state run oil company are sending mixed signals as one group of bondholders rejected the company s latest debt restructuring plan while another voiced support ,05:57:06,0.178,0.738,0.083,-0.4767
2021-02-03,singapore s battered property firms are hitting a snag in their recovery after rising coronavirus infections led to an extension of remote work in the city state ,05:54:04,0.0,1.0,0.0,0.0
2021-02-03,an under the radar business underpinning vast parts of wall street is renewing attempts to overhaul how stock trades settle after the crisis engulfing robinhood ,05:51:06,0.146,0.854,0.0,-0.6249
2021-02-03,the u s mint said it is still rationing its sales of silver coins because of exceptional market demand as well as limited supplies and manufacturing capacity ,05:45:10,0.124,0.8,0.076,-0.0772
2021-02-03,the founders of china is retail trading apps are making billions on market mania ,05:40:08,0.0,1.0,0.0,0.0
2021-02-03,u s calls military is takeover in myanmar a coup will review aid and possibility of new sanctions ,05:39:04,0.0,1.0,0.0,0.0
2021-02-03,spacex s second test flight of a new deep space vehicle ended in another explosive fireball ,05:37:04,0.0,1.0,0.0,0.0
2021-02-03,airstream trailers are getting a work from home makeover ,05:35:05,0.0,1.0,0.0,0.0
2021-02-03,as the pandemic begins to recede in u s states illinois is among america s most improved ,05:28:08,0.0,0.793,0.207,0.5256
2021-02-03,the number of ppp loans to u s small businesses more than doubled in the third week of the latest round of pandemic relief aid ,05:25:08,0.0,0.827,0.173,0.5267
2021-02-03,biden is pick for agriculture secretary tom vilsack promises to fully deeply and completely root out discrimination against minority farmers ,05:23:04,0.0,0.88,0.12,0.3818
2021-02-03,daimler is nearing a decision to formally move ahead with a potential ipo of its massive heavy truck unit ,05:21:04,0.0,1.0,0.0,0.0
2021-02-03,laurentian university owes three banks millions of dollars according to a bankruptcy filing that could be be a test case for how canada s schools deal with growing financial pressures ,05:21:04,0.079,0.862,0.059,-0.1531
2021-02-03,china is staring down another liquidity test just days after fending off its worst cash crunch since ,05:21:04,0.204,0.796,0.0,-0.6249
2021-02-03,breaking jeff bezos will step down as ceo of amazon and transition to the role of executive chairman andy jassy will succeed him in the third quarter of ,05:14:06,0.0,0.841,0.159,0.5994
