date,tweet,time,neg,neu,pos,compound
2021-02-01,the blank check company craze that s taken wall street by storm is now spreading to asia ,17:08:04,0.096,0.904,0.0,-0.1531
2021-02-01,even within president biden s white house there s debate about how to meet his promise to issue americans another each in stimulus checks ,17:00:11,0.0,0.901,0.099,0.3182
2021-02-01,sovereign bonds in india slid and the rupee declined after the country is finance minister outlined a higher than expected borrowing plan for the new fiscal year ,16:55:05,0.0,1.0,0.0,0.0
2021-02-01,former president trump is indonesian partner mnc investama said it received court approval for its debt plan after agreeing to lower its standalone borrowings by ,16:55:05,0.151,0.673,0.176,0.2023
2021-02-01,south korea s exports posted its best january on record while manufacturing activity reached the strongest level in a decade ,16:55:05,0.0,0.638,0.362,0.8176
2021-02-01,india unveiled a budget that blows out the fiscal deficit wider than expected ,16:54:04,0.197,0.803,0.0,-0.4019
2021-02-01,nintendo reported its best quarterly earnings since and raised its sales outlook on strong demand for its switch console ,16:53:05,0.06,0.64,0.3,0.7906
2021-02-01,india will set up a company to manage bad debt for banks which is expected to reach record levels this year ,16:50:04,0.249,0.705,0.046,-0.7096
2021-02-01,myanmar is de facto leader aung san suu kyi and other top political leaders were detained in an early morning raid in an apparent coup follow the latest developments in our storythread ,16:49:25,0.078,0.87,0.052,-0.2263
2021-02-01,philippine president duterte orders manila to place a day cap on pork prices that have almost doubled from last year ,16:49:03,0.0,1.0,0.0,0.0
2021-02-01,factory activity across much of asia continued to hold up in january even as china s output showed signs of moderating ,16:49:01,0.0,1.0,0.0,0.0
2021-02-01,the u s air force sets aside million in development payments from boeing and is doling out the funds over time ,16:45:09,0.0,1.0,0.0,0.0
2021-02-01,elon musk tells people on clubhouse that he is wired up a monkey is brain to play video games he is a happy monkey musk says ,16:44:03,0.0,0.783,0.217,0.7269
2021-02-01,japan airlines is now forecasting a net loss of billion yen for the months ending march ,16:35:05,0.417,0.583,0.0,-0.9186
2021-02-01,here is a rundown of your top economic news today ,16:31:02,0.0,0.816,0.184,0.2023
2021-02-01,singapore tables a bill to formalize the use of contact tracing data in criminal investigations for serious offenses after it was revealed that such information was used for that purpose in a murder case ,16:28:06,0.298,0.702,0.0,-0.8979
2021-02-01,the u s air force sets aside million in development payments from boeing and is doling out the funds over time ,16:19:02,0.0,1.0,0.0,0.0
2021-02-01,trump s last minute remake of his impeachment defense team leaves little time to prepare for arguments that are scheduled to start next week over impeachment charge ,16:18:03,0.096,0.851,0.053,-0.296
2021-02-01,headhunters start to assemble a preliminary list of luxury industry heavyweights including gucci ceo marco bizzarri to head ferrari sources say ,15:47:04,0.0,1.0,0.0,0.0
2021-02-01,u k online fashion retailer asos agrees to buy topshop and other labels for million planning to close all the stores ,15:45:15,0.0,0.59,0.41,0.93
2021-02-01,taiwan said its current account and trade surpluses not fx moves landed it on the u s watchlist ,15:43:06,0.0,1.0,0.0,0.0
2021-02-01,india will target a budget deficit of of gdp next fiscal year sources say sticking with higher spending to revive growth ,15:41:04,0.109,0.688,0.202,0.3182
2021-02-01,ryanair expects to lose as much as billion in the year through march as a resurgence of covid cases prompts new travel curbs ,15:31:08,0.323,0.677,0.0,-0.9186
2021-02-01,if the queen s gambit could put a run on chess boards could it also inspire travel ,15:31:06,0.0,0.791,0.209,0.5719
2021-02-01,in today is brussels edition it is angela merkel is turn to try and reboot the region s stumbling vaccine efforts ,15:21:02,0.0,1.0,0.0,0.0
2021-02-01,britain has committed to a reduction in emissions by compared to here s why heat pumps are crucial to meeting that goal ,15:16:04,0.0,0.9,0.1,0.2732
2021-02-01,britain has committed to a reduction in emissions by compared to here s why heat pumps are crucial to meeting that goal ,15:16:04,0.0,0.9,0.1,0.2732
2021-02-01,reddit traders dominate the narrative europe is vaccine supply worries and a new u s stimulus proposal what to watch on monday ,14:49:18,0.202,0.798,0.0,-0.5106
2021-02-01,japan s decades long love affair with status symbol office towers is now fading as the pandemic upends work styles and puts a strain on company finances ,14:47:01,0.042,0.81,0.148,0.6124
2021-02-01,a jump in the price of bitcoin sparked last week by elon musk s twitter profile had largely unwound by monday ,14:37:04,0.0,1.0,0.0,0.0
2021-02-01,a saudi food and beverage technology firm raised million riyals in funding led by a company controlled by the kingdom s sovereign wealth fund ,14:26:05,0.0,0.862,0.138,0.4939
2021-02-01,young bankers waiting to learn when or whether they might be relocated to the eu can take some solace from the fact that oftentimes their bosses also don t know their own fate ,14:18:03,0.0,1.0,0.0,0.0
2021-02-01,crypto broker received a securities house license from swiss financial regulator finma that will allow the company to offer services to more institutional investors ,14:18:03,0.0,0.837,0.163,0.4767
2021-02-01,angela merkel is starting to crack under the pressure of germany s faltering coronavirus vaccine program ,14:17:04,0.136,0.864,0.0,-0.296
2021-02-01,the bank of england is preparing to take a significant step into the debate on whether negative interest rates should be used to stimulate the coronavirus stricken u k economy ,14:17:02,0.196,0.616,0.188,-0.3182
2021-02-01,governments risk backlash as they exploit covid data for other uses ,14:16:01,0.28,0.72,0.0,-0.3612
2021-02-01,chinese billionaire li shufu shook up the car industry with a run of deals that made his zhejiang geely a global force to be reckoned with now he s training his sights on big tech ,13:51:16,0.043,0.957,0.0,-0.1027
2021-02-01,the bout of short covering that roiled global markets looks highly concentrated in a handful of small caps rather than a more extensive phenomenon ,13:30:22,0.0,1.0,0.0,0.0
2021-02-01,whither pithivier why chefs are turning to buffed up puff pastry ,13:05:05,0.0,1.0,0.0,0.0
2021-02-01,south african stocks have made their best start to the year since and jpmorgan and bank of america are among those predicting further gains ,12:59:02,0.0,0.769,0.231,0.765
2021-02-01,can japan is prime minister recover from his tanking popularity a q amp a between moss eco and observingjapan addresses this and more via bopinion,12:55:03,0.0,0.871,0.129,0.4767
2021-02-01,parcel locker company inpost has clinched a five year deal with amazon as the u s giant enters poland s revved up billion e commerce market ,12:53:06,0.0,0.922,0.078,0.1779
2021-02-01,three listed companies of china s hna says shareholders and affiliates misappropriated at least billion of funds ,12:53:05,0.0,1.0,0.0,0.0
2021-02-01,the former ceo of just eat is putting his own money into one of egypt s main food delivery apps ,12:53:05,0.0,1.0,0.0,0.0
2021-02-01,battery maker microvast will go public via a merger with blank check company tuscan holdings corp sources say ,12:50:04,0.0,1.0,0.0,0.0
2021-02-01,mt gox is implosion left a horde of creditors across the globe this insider explains how the collapse of the largest bitcoin exchange went down ,12:49:03,0.122,0.878,0.0,-0.4939
2021-02-01,australian home prices rose in january setting the scene for another year of growth as record low interest rates and a rapid recovery from the coronavirus induced recession spur demand ,12:47:01,0.315,0.556,0.13,-0.875
2021-02-01,u k private equity firm manzanita capital is exploring options including a sale of skincare brand eve lom which is famous for its cleanser balm sources say ,12:39:06,0.0,1.0,0.0,0.0
2021-02-01,retail traders board battle bus in south korea war on short sellers ,12:32:11,0.394,0.606,0.0,-0.7579
2021-02-01,leading dubai companies have formed an alliance to move billion doses of covid vaccines around the globe this year ,12:28:58,0.0,1.0,0.0,0.0
2021-02-01,an official gauge of china s manufacturing output slipped for a second month in january while activity in the services sector slowed to the lowest reading since march ,12:12:06,0.094,0.906,0.0,-0.3818
2021-02-01,this is how the south china sea became a major flashpoint in u s china relations watch in full ,11:56:10,0.0,1.0,0.0,0.0
2021-02-01,here are five key numbers to watch in india is budget as prime minister narendra modi is expected to spur demand and investments in an economy cratered by the world s second biggest covid outbreak ,11:45:07,0.043,0.957,0.0,-0.128
2021-02-01,trump s leadership pac ended with million in the bank ,11:40:05,0.0,1.0,0.0,0.0
2021-02-01,knotel files for bankruptcy as pandemic strains office rentals ,11:39:04,0.216,0.784,0.0,-0.296
2021-02-01,biden withdraws billion in spending cuts proposed by trump ,11:39:03,0.216,0.784,0.0,-0.296
2021-02-01,silver surged at the week s open as the the reddit inspired frenzy that roiled stock markets last week spills over into commodities ,11:37:30,0.09,0.784,0.125,0.2263
2021-02-01,watch bloomberg is southeast asia government reporter pjheijmans explains what is happening in myanmar right now via bloombergtv latest updates ,11:25:01,0.0,1.0,0.0,0.0
2021-02-01,colin cowherd sports radio s biggest star starts a podcast network ,11:17:05,0.0,1.0,0.0,0.0
2021-02-01,stakes are high as india vows to unveil a budget like no other here are things to watch out for when it is released on monday via quicktake more unionbudget indiabudget ,11:00:10,0.067,0.856,0.076,0.0772
2021-02-01,the blank check company craze that s taken wall street by storm is now spreading to asia ,10:37:06,0.096,0.904,0.0,-0.1531
2021-02-01,breaking myanmar s military has taken power for a year after declaring a state of emergency in response to its claims of election fraud reports said after aung san suu kyi and other top leaders were detained in an early morning raid ,10:35:16,0.198,0.763,0.039,-0.8074
2021-02-01,china solar giant gcl poly defaults on million dollar bond ,10:34:06,0.0,1.0,0.0,0.0
2021-02-01,here is how to make a billion business from online gift giving ,10:25:03,0.0,0.629,0.371,0.6486
2021-02-01,investors in india s billion sovereign bond market are on tenterhooks ahead of the budget ,10:18:05,0.0,1.0,0.0,0.0
2021-02-01,with their makeshift sewage systems and terrible ventilation hong kong is notorious coffin homes are sparking a covid surge via citylab,10:17:07,0.25,0.75,0.0,-0.7184
2021-02-01,japan s kei cars known for their affordability and small engines face a potentially existential threat as the country leans on automakers to go electric ,10:11:04,0.134,0.866,0.0,-0.5267
2021-02-01, silver surges as reddit frenzy spills over china recovery undercut by virus fight the spac spending spree is moving to asia here are some of the things you need to know at the start of asia is trading day ,09:54:03,0.117,0.883,0.0,-0.5994
2021-02-01,latest tv channels in myanmar are down while phone and internet communications are patchy earlier aung san suu kyi and other top leaders were detained in an early morning raid in an apparent coup a ruling party spokesman confirmed ,09:39:19,0.064,0.829,0.107,0.2023
2021-02-01,japan considers extension of covid state of emergency as economy sputters ,09:30:10,0.206,0.794,0.0,-0.3818
2021-02-01,here s the latest news and analysis from bloomberg economics ,09:08:46,0.0,1.0,0.0,0.0
2021-02-01,u k businesses call for a clear roadmap to reopening the economy ,08:54:15,0.0,0.755,0.245,0.3818
2021-02-01,closing u k schools to help fight the virus could cost students an average of in lost earnings during their careers according to a new report ,08:54:15,0.178,0.725,0.098,-0.296
2021-02-01,the u k is set to confirm that residents at every eligible care home in england have been offered a covid vaccine ,08:54:13,0.0,0.849,0.151,0.4939
2021-02-01,oil drops below as virus resurgence weighs on demand outlook ,08:52:47,0.59,0.41,0.0,-0.926
2021-02-01,democratic control of the u s senate already means pro cannabis laws have a better shot this year it s also poised to boost the industry in a less direct way by amping up traction for social justice issues ,08:35:03,0.0,0.732,0.268,0.875
2021-02-01,five things you need to know at the start of asia is trading day ,08:17:29,0.0,1.0,0.0,0.0
2021-02-01,governments risk backlash as they exploit covid data for other uses ,08:10:27,0.28,0.72,0.0,-0.3612
2021-02-01,here is the latest on the coronavirus pandemic ,07:59:59,0.0,1.0,0.0,0.0
2021-02-01,silver surged at the week s open as the the reddit inspired frenzy that roiled stock markets last week spills over into commodities ,07:54:43,0.09,0.784,0.125,0.2263
2021-02-01,aung san suu kyi president win myint and other leaders were notaken the reuters report said citing a spokesman for the ruling national league for democracy more ,07:46:58,0.0,0.868,0.132,0.5859
2021-02-01,australian home prices rose in january setting the scene for another year of growth as record low interest rates and a rapid recovery from the coronavirus induced recession spur demand ,07:46:06,0.315,0.556,0.13,-0.875
2021-02-01,former president trump is indonesian partner mnc investama said it received court approval for its debt plan after agreeing to lower its standalone borrowings by ,07:46:06,0.151,0.673,0.176,0.2023
2021-02-01,as streaming services compete with one another for new users they are turning to sports and indie movies to stand out from the crowd ,07:46:06,0.0,1.0,0.0,0.0
2021-02-01,myanmar leaders including aung san suu kyi and the president have been detained in an early morning raid according to a report amid fears of a coup ,07:42:06,0.193,0.807,0.0,-0.6705
2021-02-01,mt gox is implosion left a horde of creditors across the globe this insider explains how the collapse of the largest bitcoin exchange went down ,07:31:55,0.122,0.878,0.0,-0.4939
2021-02-01,robinhood reduces the number of companies on its list of trading restrictions ,07:09:41,0.0,0.894,0.106,0.0772
2021-02-01,colin cowherd sports radio s biggest star starts a podcast network ,06:48:13,0.0,1.0,0.0,0.0
2021-02-01,the blank check company craze that s taken wall street by storm is now spreading to asia ,06:32:30,0.096,0.904,0.0,-0.1531
2021-02-01,rogue captain is mid ocean detour helped expose humanitarian crisis ,06:32:30,0.416,0.584,0.0,-0.6908
2021-02-01,representative adam kinzinger one of the most vocal gop critics of donald trump has launched a political action committee to challenge the former president s influence on the republican party ,06:15:42,0.077,0.751,0.172,0.2585
2021-02-01,the ceos of exxon mobil and chevron spoke last year about combining dow jones reports ,05:55:24,0.0,1.0,0.0,0.0
2021-02-01,all you need to know about what s moving markets ,05:48:28,0.0,1.0,0.0,0.0
2021-02-01,japan s decades long love affair with status symbol office towers is now fading as the pandemic upends work styles and puts a strain on company finances ,05:34:29,0.042,0.81,0.148,0.6124
2021-02-01,former president donald trump is days away from an early deadline in his second impeachment trial and is apparently without lawyers to represent him ,05:27:39,0.0,1.0,0.0,0.0
2021-02-01,retail sites were overwhelmed with physical demand for silver on sunday suggesting the reddit inspired frenzy that roiled commodities markets last week is spilling over into physical bars and coins ,05:16:38,0.111,0.76,0.129,0.1531
2021-02-01,what is the citadel link to gamestop ,04:54:49,0.0,1.0,0.0,0.0
2021-02-01,democratic control of the u s senate already means pro cannabis laws have a better shot this year it s also poised to boost the industry in a less direct way by amping up traction for social justice issues ,04:30:22,0.0,0.732,0.268,0.875
2021-02-01,ikea is going beyond making its billy bookshelves environmentally sustainable setting stretch targets to help improve forest management and biodiversity across the globe ,04:10:06,0.0,0.789,0.211,0.6808
2021-02-01,mt gox is implosion left a horde of creditors across the globe this insider explains how the collapse of the largest bitcoin exchange went down ,04:04:04,0.122,0.878,0.0,-0.4939
2021-02-01,here are five key numbers to watch in india is budget as prime minister narendra modi is expected to spur demand and investments in an economy cratered by the world s second biggest covid outbreak ,04:03:09,0.043,0.957,0.0,-0.128
2021-02-01,president biden s top economic advisers expressed confidence in u s market regulators with one saying they should be concerned less with speculation and volatility than with ensuring that the underlying plumbing is sound ,04:03:04,0.0,0.795,0.205,0.7351
2021-02-01,as more and more people compete for short supplies of the life saving covid vaccine some of the oldest and most infirm americans are struggling just to enter the contest ,04:01:06,0.088,0.912,0.0,-0.4215
2021-02-01,melvin capital lost about in january on its investment in gamestop and other bets after finding itself on the wrong end of a short squeeze ,03:49:04,0.197,0.803,0.0,-0.6597
2021-02-01,retail sites were overwhelmed with physical demand for silver on sunday suggesting the reddit inspired frenzy that roiled commodities markets last week is spilling over into physical bars and coins ,03:34:33,0.111,0.76,0.129,0.1531
2021-02-01,astrazeneca will deliver million additional vaccine doses to the european union in the first quarter of this year european commission president ursula von der leyen says ,03:31:52,0.0,1.0,0.0,0.0
2021-02-01,australia only recently started its quantitative easing program yet the key question already confronting the central bank is when and how to taper bond purchases given the strong economic recovery ,03:31:52,0.047,0.796,0.156,0.5719
2021-02-01,president biden is top health adviser warns that a new variant of the coronavirus circulating in the u k will likely become the dominant strain in the u s ,03:25:30,0.102,0.827,0.071,0.0516
2021-02-01,pfizer s ceo we do not know yet but it looks like covid is here to stay via bw,03:05:04,0.0,0.84,0.16,0.5023
2021-02-01,ten republican senators proposed an alternative plan for covid economic stimulus costing about billion ,03:00:11,0.0,1.0,0.0,0.0
2021-02-01,why the reddit army bailout is the kind of rescue that the most indebted u s firms can only dream of ,02:58:04,0.062,0.714,0.223,0.5584
2021-02-01,silver lake exited its equity stake in amc generating around million after converting bonds to equity and selling the shares as the movie theater chain s stock rallied ,02:51:06,0.0,0.922,0.078,0.296
2021-02-01,the eu says it s taking steps to bolster its pandemic preparedness citing the risk posed by covid variants ,02:49:49,0.11,0.89,0.0,-0.2732
2021-02-01,the death of a year old man with covid who wasn t fed for hours or seen by a doctor for almost three days has shown the dire state of some of south africa s public hospitals ,02:41:06,0.182,0.818,0.0,-0.7845
2021-02-01,from brexit to migration the eu has weathered a multitude of crises over the past two decades none has affected its citizens in such a profound way as its failure to inoculate them against the coronavirus ,02:30:15,0.09,0.871,0.039,-0.4322
2021-02-01,the u k expects some hong kong residents who hold special passports to take advantage of the new pathway to citizenship over the next five years ,02:25:06,0.0,0.824,0.176,0.5719
2021-02-01,the u k government withdrew an online advert urging people to stay at home during the pandemic because it showed pictures of women doing all the household chores and childcare while the only man featured was lounging on a couch ,02:10:04,0.0,1.0,0.0,0.0
2021-02-01,new york city broke down its covid vaccination data by ethnicity for the first time with the mayor underscoring a profound problem with racial inequality ,02:07:44,0.2,0.8,0.0,-0.6705
2021-02-01,south africa s finance industry regulator wants more power to prosecute perpetrators of fraud and oversee dealing in cryptocurrencies after the collapse of a bitcoin trader alleged to be the country s largest ponzi scheme ,02:06:05,0.299,0.701,0.0,-0.8993
2021-02-01,here is a simple recipe to make prawn potstickers at home just in time for chinese new year ,01:52:02,0.0,1.0,0.0,0.0
2021-02-01,the market for leveraged loans marches on ,01:45:07,0.0,1.0,0.0,0.0
2021-02-01,more than people were arrested across russia including the wife of jailed opposition leader alexey navalny ,01:26:04,0.31,0.69,0.0,-0.743
2021-02-01,opec and its partners estimate they implemented of their agreed oil supply curbs in january according to one delegate ,01:25:55,0.0,0.896,0.104,0.2732
2021-02-01,israel leads the fight against covid with more than of its population vaccinated yet the emergence of more infectious variants is overwhelming its hospitals showing the long road ahead for the rest of the world ,01:20:03,0.071,0.929,0.0,-0.3818
2021-02-01,discussions are reportedly underway in government departments to consider the possibility of lifting south africa s alcohol ban as infection rates ease ,01:16:28,0.143,0.757,0.1,-0.2732
2021-02-01,it is hard to get rich as a solar investor even for the fund manager who made a return on solar companies ,01:15:03,0.061,0.783,0.157,0.4939
2021-02-01,ukraine has no vaccine yet and breakaway regions in the east have turned to russia ,01:11:02,0.136,0.864,0.0,-0.296
2021-02-01,covid has pushed global debt to historic levels here s what happens when the bill comes due ,01:06:06,0.143,0.857,0.0,-0.3612
2021-02-01,president biden s top economic advisers expressed confidence in u s market regulators with one saying they should be concerned less with speculation and volatility than with ensuring that the underlying plumbing is sound ,00:55:28,0.0,0.795,0.205,0.7351
2021-02-01,talks aimed at building support for a new italian government will continue after consultations over the weekend failed to produce an agreement on a new government and end political deadlock ,00:54:05,0.16,0.674,0.166,0.0516
2021-02-01,melvin capital lost about in january on its investment in gamestop and other bets after finding itself on the wrong end of short squeeze ,00:43:58,0.197,0.803,0.0,-0.6597
2021-02-01,the u k s national grid said it s anticipating tight margins on the electricity system on monday evening owing partly to weather related factors ,00:43:56,0.0,1.0,0.0,0.0
2021-02-01,democratic control of the u s senate already means pro cannabis laws have a better shot this year it s also poised to boost the industry in a less direct way by amping up traction for social justice issues ,00:33:27,0.0,0.732,0.268,0.875
2021-02-01,the u k s third major lockdown to control the coronavirus could be the final straw for thousands of businesses struggling to pay rent and taxes with little or no money coming in the door ,00:24:03,0.174,0.826,0.0,-0.6275
2021-02-01,russia is squeezing wheat exports to push down prices in a country with a history of public anger over the cost of bread ,00:20:07,0.156,0.844,0.0,-0.5719
2021-02-01,biden is making swift and extensive use of the unilateral powers he now wields here is what to know about executive actions by the u s president ,00:20:06,0.0,0.93,0.07,0.2023
2021-02-01,when german chancellor merkel steps down after nearly years in power it won t just be her legacy that s at stake germany s leadership of europe will be tested ,00:19:03,0.0,0.875,0.125,0.5719
2021-02-01,grindr warned of a million fine in norway for sharing user data with third parties without proper consent ,00:17:01,0.163,0.52,0.316,0.5475
2021-02-01,the late boris berezovsky s creditors stand to gain from a court struggle to get hold of a cap d antibes mansion valued at more than million ,00:10:04,0.065,0.568,0.366,0.9274
2021-02-01,a hong kong developer has won approval to build a new skyscraper in the city of london betting demand for office space will endure beyond the pandemic ,00:06:07,0.05,0.726,0.224,0.743
2021-02-01, the astrazeneca oxford shot gets eu approval j amp j reported findings on its single dose vaccine here is where things stand in the pandemic this week ,00:00:02,0.0,0.886,0.114,0.4767
2021-01-31,the silver market seems to be on high alert after a push by reddit posters to create a short squeeze ,23:52:05,0.0,0.788,0.212,0.5106
2021-01-31,germany s economy minister says tax increases are the wrong way to handle the costs of the coronavirus crisis and proposed selling state holdings instead ,23:42:00,0.188,0.55,0.262,0.7003
2021-01-31,reddit traders made a splash in the silver market but may find other commodities harder to crack ,23:21:08,0.0,1.0,0.0,0.0
2021-01-31,andrea orcel is back after some time away from the top ranks of european finance but the challenges for the new ceo of unicredit are just beginning ,23:21:06,0.0,0.898,0.102,0.2144
2021-01-31,iceland has so far managed to contain a highly contagious british variant of the coronavirus that s threatening to wash across europe ,23:14:02,0.253,0.747,0.0,-0.7264
2021-01-31,as biting cold caused power demand to surge across western europe this month the continent s power grid came close to a massive blackout ,23:11:05,0.067,0.933,0.0,-0.128
2021-01-31,portuguese airline tap said it will suspend more operations than previously planned in february after additional travel restrictions were announced ,23:10:24,0.108,0.892,0.0,-0.3182
2021-01-31,the swedish green party has elected marta stenevi as its new co leader after a special congress on sunday ,23:08:52,0.0,0.748,0.252,0.6597
