date,tweet,time,neg,neu,pos,compound
2021-02-02,bytedance sues tencent holdings over alleged monopolies in its wechat and qq platforms escalating a feud between the chinese social media giants ,19:44:04,0.228,0.772,0.0,-0.6808
2021-02-02,for now at least history is on putin s side ,19:42:08,0.0,1.0,0.0,0.0
2021-02-02,the wild run up of trades popular with reddit crowds is starting to come crashing down ,19:33:58,0.0,0.843,0.157,0.4215
2021-02-02,the parent company of britain is ladrokes betting shops seeks to buy the wagering and media division of australia s largest gambling company tabcorp holdings ,19:10:03,0.0,0.697,0.303,0.9186
2021-02-02,ford is making its biggest ever investment in south africa plowing billion into its plant near pretoria ,19:10:02,0.0,1.0,0.0,0.0
2021-02-02,how china s private refiners upended the oil market ,18:58:02,0.0,1.0,0.0,0.0
2021-02-02,turkey wants to regulate crowdfunders who ve been trying to boost home buying by pooling together the monthly savings of thousands of people ,18:54:03,0.0,0.891,0.109,0.4019
2021-02-02,here is how to make a billion business from online gift giving ,18:52:06,0.0,0.629,0.371,0.6486
2021-02-02,turkey arrested more than students peacefully protesting president recep tayyip erdogan s appointment of a loyalist to head their elite university ,18:50:07,0.218,0.554,0.228,0.0679
2021-02-02,a moscow court began the embezzlement trial of prominent u s investor michael calvey even after a related corporate dispute was settled ,18:49:02,0.129,0.762,0.11,-0.1027
2021-02-02,president biden will reverse donald trump s crackdown on asylum seekers and refugees ,18:45:02,0.0,1.0,0.0,0.0
2021-02-02,cairn capital is set to manage billion of assets after its acquisition of distressed debt fund manager bybrook ,18:31:07,0.241,0.682,0.077,-0.5574
2021-02-02,in a rare move india is banking regulator appoints an external firm to audit hdfc bank is technology infrastructure after repeated outages ,18:31:07,0.0,1.0,0.0,0.0
2021-02-02,deaths linked to covid in england and wales climb to the second highest level of the pandemic ,18:20:56,0.0,1.0,0.0,0.0
2021-02-02,hong kong authorities threaten to knock down doors to force covid tests ,18:14:04,0.191,0.809,0.0,-0.3818
2021-02-02,the fbi has accused an mit professor of working for china his colleagues say all universities now look for grants beyond the federal government which has cut funding writes anjani trivedi via bopinion,18:07:06,0.119,0.829,0.052,-0.34
2021-02-02,the lengthening of the work day observed as many began working from home last year has become the new normal in many countries ,18:05:05,0.0,1.0,0.0,0.0
2021-02-02,get the latest updates on the pandemic ,18:04:04,0.0,1.0,0.0,0.0
2021-02-02,u k is market watchdog will start regulating the buy now pay later sector as online shopping booms during the pandemic ,18:02:06,0.049,0.599,0.352,0.9118
2021-02-02,one country has a vital role to play in africa is business in ,18:00:09,0.0,0.685,0.315,0.5574
2021-02-02,the gamestop short squeeze is one of the most extraordinary events to ever happen in markets but does it have political significance ,17:59:04,0.0,0.888,0.112,0.3919
2021-02-02,doubling up could help in some situations ,17:58:02,0.0,0.69,0.31,0.4019
2021-02-02,hong kong retail sales plunged in december as the government tightened social distancing ,17:56:05,0.0,1.0,0.0,0.0
2021-02-02,the u k defends a delay in imposing hotel quarantine for travelers arriving from virus hot spots even as officials battle to contain the spread of a new variant ,17:56:05,0.223,0.777,0.0,-0.6486
2021-02-02, what is the myanmar military is endgame what is china is role in all this how will this impact the global economy ,17:53:04,0.0,1.0,0.0,0.0
2021-02-02,israel s prime minister benjamin netanyahu is planning to travel to the uae next week in the first public visit by an israeli leader to the country ,17:51:01,0.0,1.0,0.0,0.0
2021-02-02,philippine airlines owned by billionaire lucio tan will cut jobs or about a third of its workforce by mid march ,17:50:07,0.104,0.896,0.0,-0.2732
2021-02-02,heirs oil amp gas will restore a nigerian oil block acquired from royal dutch shell to its former output levels ,17:49:06,0.131,0.769,0.1,-0.1779
2021-02-02,teraco data environments africa s largest data center company raised million to fund the construction of a new facility in south africa ,17:49:06,0.0,1.0,0.0,0.0
2021-02-02,india is mammoth spending plan of almost billion is expected to jump start growth but may not be enough to tackle rising unemployment and poverty ,17:48:03,0.259,0.685,0.056,-0.8176
2021-02-02,the disruption caused by silver s reddit fueled surge has spread all the way to the souks of the middle east ,17:35:03,0.116,0.884,0.0,-0.3612
2021-02-02,italy s economy shrank in its latest data the latest piece of bad news for a nation that is now embroiled in a government crisis ,17:31:35,0.275,0.725,0.0,-0.8225
2021-02-02,pakistan s supreme court orders the pakistani british man acquitted of the gruesome beheading of american journalist daniel pearl off death row ap reports ,17:26:32,0.132,0.678,0.19,0.1779
2021-02-02,the baby boom widely anticipated after pandemic lockdowns took effect has not materialized with five states showing large declines in birth rates ,17:26:03,0.323,0.677,0.0,-0.9186
2021-02-02,gamestop s spectacular rally unwinds further pulling other recent favorites of reddit speculators down with it ,17:25:47,0.0,0.833,0.167,0.4215
2021-02-02,the gamestop game has moved on to silver via bopinion,17:20:05,0.0,1.0,0.0,0.0
2021-02-02,the main landlord of london is covent garden slashes the district is value ,17:19:02,0.118,0.724,0.158,0.1531
2021-02-02,hundreds of members of myanmar is parliament remain confined inside their government housing in yangon a day after the military staged a coup ,17:05:40,0.0,1.0,0.0,0.0
2021-02-02,president biden and top democrats signal support for a large pandemic relief bill potentially without gop support even after a productive white house meeting ,17:01:07,0.0,0.636,0.364,0.8519
2021-02-02,smartphone apps short selling rules and steps to ensure broker solvency are all sure to get a closer look from washington once the gamestop dust settles ,17:01:07,0.0,0.824,0.176,0.5994
2021-02-02,singapore is sticking to its goal to move away from libor by the end of ,16:58:05,0.0,1.0,0.0,0.0
2021-02-02,online greeting card company moonpig and shareholders raise million in a london ipo ,16:50:33,0.0,0.809,0.191,0.3818
2021-02-02,fresenius medical falls the most in more than two years after the kidney dialysis company loses patients to the pandemic ,16:48:41,0.406,0.594,0.0,-0.936
2021-02-02,the biggest oil producer in the uae is getting a million investment in its property business from a state pension fund ,16:46:06,0.0,1.0,0.0,0.0
2021-02-02,bp earnings fall short of expectations as the pandemic continued to hurt fuel sales and refining profit margins ,16:35:05,0.116,0.544,0.34,0.8625
2021-02-02,u k house prices fell last month for the first time since june as a temporary cut in the tax on purchases approached its expiration date ,16:30:11,0.087,0.913,0.0,-0.2732
2021-02-02,millennials have emerged as a potent force in luxury real estate during covid ,16:23:04,0.0,1.0,0.0,0.0
2021-02-02,mcdonald s has quietly begun selling the mcplant burger in denmark and sweden ,16:20:04,0.0,1.0,0.0,0.0
2021-02-02,donald trump s lawyers will mount a double barreled defense in his impeachment trial next week arguing that the process was rushed and partisan ,16:19:03,0.122,0.816,0.061,-0.3612
2021-02-02,the pentagon has tapped experts of three top u s universities to assess what still must be done to fix the f is software ,16:19:01,0.0,0.917,0.083,0.2023
2021-02-02,elon musk tops the list of climate billionaires the rest are made in china ,16:09:03,0.0,0.798,0.202,0.5106
2021-02-02,bp earnings fall short of expectations as the pandemic continued to hurt fuel sales and refining profit margins ,16:00:13,0.116,0.544,0.34,0.8625
2021-02-02,hedge fund andurand capital management is among those betting the price of carbon can only go up ,15:55:01,0.0,1.0,0.0,0.0
2021-02-02,here is how to make a billion business from online gift giving ,15:52:04,0.0,0.629,0.371,0.6486
2021-02-02,india s central bank is under pressure to step in to keep yields in check after the government surprised bond markets with a bigger than expected borrowing plan ,15:50:02,0.078,0.854,0.068,-0.0772
2021-02-02,a moscow district court is due to decide whether to jail russian opposition leader alexey navalny for as long as years ,15:49:01,0.0,1.0,0.0,0.0
2021-02-02,military coup state of emergency aung san suu kyi detained what s the situation in myanmar bloomberg s dantenkate tells rumireports ,15:45:50,0.238,0.762,0.0,-0.6486
2021-02-02,even for die hard fans the most magical place on earth isn t stateside it s in tokyo ,15:42:07,0.275,0.725,0.0,-0.6486
2021-02-02,a growing number of swedish banks will start turning clients away if their businesses aren t clean enough to justify new loans ,15:40:03,0.0,0.749,0.251,0.5719
2021-02-02,swiss national bank president thomas jordan says u s censure won t stop his institution s purchases of foreign exchange to fend off deflation ,15:31:08,0.092,0.753,0.155,0.3612
2021-02-02,data shows the pandemic hit is not so bad the eu is blame game and more in today is brussels edition ,15:26:06,0.096,0.761,0.143,0.2922
2021-02-02,as china asserts control over hong kong the u k offers some residents of its former colony a potential route out follow our full coverage here ,15:24:04,0.0,1.0,0.0,0.0
2021-02-02,the vix is way high but credit volatility is low here is your chance to hedge ,15:16:03,0.123,0.603,0.274,0.5023
2021-02-02,australia s central bank will extend its quantitative easing program by a further a billion and doesn t expect to increase interest rates until ,15:16:02,0.0,0.64,0.36,0.7906
2021-02-02,sweden s economy dodged a contraction last quarter providing the first glimpse of how its no lockdown strategy of affected businesses and consumers throughout the year ,15:14:06,0.147,0.853,0.0,-0.4215
2021-02-02,india is opening its doors to cheaper steel cutting taxes on shipments of the alloy amid surging prices at home as it focuses on building infrastructure to revive the economy ,15:10:05,0.047,0.878,0.075,0.2263
2021-02-02,can government relief programs can be automated ,15:10:04,0.0,0.659,0.341,0.4767
2021-02-02,india the world s biggest palm oil buyer increased taxes on imports of the tropical oil s crude variety to encourage farmers to boost domestic oilseed output ,15:10:03,0.113,0.64,0.247,0.5267
2021-02-02,the government raised import duty on a range of products from raw cotton to electronics items to boost local manufacturing and generate jobs finance minister nirmala sitharaman says ,15:10:02,0.0,0.906,0.094,0.4019
2021-02-02,here is a rundown of your top economic news today ,15:06:04,0.0,0.816,0.184,0.2023
2021-02-02,ocasio cortez assailed conservatives who have downplayed threats to lawmakers and say that she and other democrats should move on ,15:06:04,0.128,0.872,0.0,-0.4215
2021-02-02,can government relief programs can be automated ,15:05:04,0.0,0.659,0.341,0.4767
2021-02-02,for months robinhood markets plan to pursue an initial public offering midyear looked more and more auspicious now it looks increasingly critical ,15:05:03,0.099,0.901,0.0,-0.3182
2021-02-02,tesla has publicly apologized to the state grid corp of china after a video showed one of the carmaker s staff purportedly telling a customer that an overload in the national grid damaged their electric vehicle caixin reports ,15:05:02,0.136,0.806,0.058,-0.4767
2021-02-02,professional darts found its star in fallon sherrock ticket sales were up then covid struck here s how organizers plan on getting the magic back via bw,15:04:06,0.074,0.926,0.0,-0.25
2021-02-02, black panther director ryan coogler has signed a five year deal to create tv shows for disney ,14:50:03,0.0,0.877,0.123,0.2732
2021-02-02,silver moves to the center of the reddit storm fallout from the eu is vaccine strategy continues and joe biden still intends to push for big stimulus what to watch on tuesday ,14:49:04,0.0,1.0,0.0,0.0
2021-02-02,just in siemens energy will cut roughly a sixth of workers from its gas and power division in the latest disruption from the worldwide shift to green energy ,14:48:39,0.145,0.723,0.132,-0.1027
2021-02-02,a decade after myanmar s highly praised opening to the outside world following decades of military rule the armed forces are back in power ,14:30:04,0.0,0.857,0.143,0.5413
2021-02-02,after absorbing a billion hit bears appear to have started covering their gamestop positions as the stock plunges ,14:13:17,0.0,1.0,0.0,0.0
2021-02-02,climate change is causing oceans to rise quicker than scientists most pessimistic forecasts new research shows ,14:11:42,0.104,0.523,0.373,0.8809
2021-02-02,japan extends a state of emergency covering major metropolitan areas to march ,14:03:23,0.198,0.687,0.115,-0.2732
2021-02-02,the pound is winning the hearts and minds of fund managers and forecasters as the u k steps up its coronavirus vaccinations ,13:50:03,0.0,0.848,0.152,0.5267
2021-02-02,british businesses ravaged by the pandemic skipped more than billion pounds in rent last year ,13:49:06,0.0,1.0,0.0,0.0
2021-02-02,siemens s soon to be solo ceo is taking over a dramatically different company from long time boss joe kaeser ,13:49:06,0.0,1.0,0.0,0.0
2021-02-02,south korean traders piled into u s stocks like gamestop and tesla in january driving their buying of overseas equities to a record high ,13:37:03,0.0,0.889,0.111,0.3612
2021-02-02,the fbi has accused an mit professor of working for china his colleagues say all universities now look for grants beyond the federal government which has cut funding writes anjani trivedi via bopinion,13:37:03,0.119,0.829,0.052,-0.34
2021-02-02, u s futures australia hong kong china south korea and japan stocks rise oil to silver drops to per ounce ,13:29:30,0.278,0.444,0.278,0.0
2021-02-02,comfort food from a cuisine worth getting to know ,13:29:03,0.0,0.577,0.423,0.5267
2021-02-02,these are the winners and losers from india is pandemic budget ,13:19:03,0.219,0.581,0.2,-0.0772
2021-02-02,andrew heyn former british ambassador to myanmar says the military coup is certainly a massive setback for the country bloombergtv ,13:14:47,0.0,0.882,0.118,0.34
2021-02-02,dubai announced monday it would close all bars and pubs for the entire month of february and limit other activities after a spike in coronavirus cases via ap,13:06:04,0.0,1.0,0.0,0.0
2021-02-02,how china s private refiners upended the oil market ,12:28:04,0.0,1.0,0.0,0.0
2021-02-02,hong kong authorities threaten to knock down doors to force covid tests ,12:08:03,0.191,0.809,0.0,-0.3818
2021-02-02,mitch mcconnell steps into house gop conflict by backing liz cheney ,12:08:03,0.185,0.726,0.089,-0.296
2021-02-02,china s top diplomat warns biden not to touch internal affairs ,12:02:24,0.125,0.714,0.161,0.1027
2021-02-02,there s a record amount of office space available in manhattan ,11:05:04,0.0,1.0,0.0,0.0
2021-02-02,the gamestop game has moved on to silver ,11:05:03,0.0,1.0,0.0,0.0
2021-02-02,joe biden said he would keep u s tariffs in place on aluminum imports from the united arab emirates reversing a last minute move by trump to scrap them ,11:04:02,0.0,0.899,0.101,0.4215
2021-02-02,the biggest knock against investing in silver may be the current reddit driven mania over the precious metal ,11:04:02,0.0,0.821,0.179,0.5719
2021-02-02,activist short seller carson block the action in gamestop looks less like a retail trader revolution than a short squeeze by hedge funds targeting other hedge funds ,11:04:02,0.103,0.818,0.079,-0.1761
2021-02-02,india plans to raise billion selling assets including its flagship carrier air india ,11:02:05,0.0,0.78,0.22,0.2732
2021-02-02,discover the plan for a digital first decarbonized society ,11:00:18,0.0,1.0,0.0,0.0
2021-02-02,the sale by saudi arabia s biggest bank of a high risk type of bond at better rates than international peers spurs concerns that investors are mispricing risk ,10:56:02,0.14,0.764,0.096,-0.0772
2021-02-02,the baby boom widely anticipated after pandemic lockdowns took effect has not materialized with five states showing large declines in birth rates ,10:55:07,0.323,0.677,0.0,-0.9186
2021-02-02,millennials have emerged as a potent force in luxury real estate during covid ,10:53:05,0.0,1.0,0.0,0.0
2021-02-02,jack ma was conspicuously absent from a list of china s entrepreneurial greats published by state media ,10:52:05,0.0,1.0,0.0,0.0
2021-02-02,house financial services panel sets gamestop hearing for feb ,10:52:05,0.0,1.0,0.0,0.0
2021-02-02,the global food trade has been upended by a container crisis ,10:45:05,0.313,0.687,0.0,-0.6249
2021-02-02,southeast asia government reporter pjheijmans will answer your questions in a live q amp a on line messenger at a m hong kong p m new york follow us on line ,10:44:04,0.0,1.0,0.0,0.0
2021-02-02,french technology services provider atos has decided to walk away from a potential deal to buy u s rival dxc technology after having their earlier bid rejected ,10:41:03,0.093,0.623,0.283,0.8658
2021-02-02,a top ruling party lawmaker wants japan to go back to its go to travel ,10:40:04,0.0,0.727,0.273,0.5423
2021-02-02,mcdonald s has quietly begun selling the mcplant burger in denmark and sweden ,10:25:05,0.0,1.0,0.0,0.0
2021-02-02,indonesia s finance ministry the central bank financial services regulator and the state deposit insurer are crafting a joint policy package to provide more financing for businesses and hasten economic recovery ,10:02:02,0.0,1.0,0.0,0.0
2021-02-02,oil rose past a barrel with help from a weakening dollar after jumping the most in three weeks on optimism over the demand outlook ,10:02:02,0.136,0.643,0.221,0.5267
2021-02-02,opec and its allies can celebrate their success in steadying world oil market but the coalition will soon be faced with some tough choices ,10:01:09,0.064,0.765,0.171,0.4497
2021-02-02,governments must find a way of measuring economic growth that takes into account the price of damaging ecosystems according to a report backed by the british government ,09:43:02,0.114,0.759,0.128,-0.1531
2021-02-02,as china asserts control over hong kong the u k offers some residents of its former colony a potential route out follow our full coverage here ,09:43:02,0.0,1.0,0.0,0.0
2021-02-02,britain will need to install electric vehicle charging points five times faster to prepare for a ban on the sale of new gasoline and diesel cars from ,09:42:05,0.126,0.874,0.0,-0.5574
2021-02-02,canada gives an emergency loan to sunwing the first sign of an airline rescue package after justin trudeau barred travel to beach destinations ,09:41:07,0.097,0.781,0.123,0.1779
2021-02-02,here is the latest on the myanmar military takeover un security council to hold emergency meeting rights groups urge release of suu kyi and leaders governments from britain to turkey condemn army action all airports in the country shut ,09:25:04,0.119,0.826,0.055,-0.4215
2021-02-02,what is next after the coup in myanmar southeast asia government reporter pjheijmans will answer your questions in a live q amp a on line messenger at a m hong kong p m new york here is how to follow us on line ,09:11:29,0.0,1.0,0.0,0.0
2021-02-02, biden signals sanctions against myanmar u s shares see biggest rally in weeks elon musk gives bitcoin another boost here are some of the things you need to know at the start of asia is trading day ,08:59:52,0.0,0.871,0.129,0.5994
2021-02-02,boeing is at risk of losing more than a third of its x order haul because the latest delay gives some customers the right to walk away from sales contracts ,08:52:07,0.219,0.781,0.0,-0.7184
2021-02-02,this european country is doing well on vaccines thanks to its links with china ,08:43:04,0.0,0.706,0.294,0.6124
2021-02-02,exxon mobil is expected to announce board changes as soon as tuesday and talks are continuing with investor d e shaw that may lead to additional director nominations ,08:37:07,0.0,1.0,0.0,0.0
2021-02-02,gamestop bears now look like they re starting to cover their positions as the video game retailer s stock plunged ,08:25:08,0.0,0.878,0.122,0.3612
2021-02-02,five things you need to know at the start of asia is trading day ,08:22:08,0.0,1.0,0.0,0.0
2021-02-02,playstudios an online game operator backed by casino giant mgm resorts is going public via a billion merger with a spac ,08:18:06,0.0,0.942,0.058,0.0258
2021-02-02,chicago officials said they made substantial progress in negotiations with the teachers union over a return to in person learning ,08:12:05,0.0,0.787,0.213,0.5574
2021-02-02,dennis muilenburg the former chief executive officer of boeing has filed for a blank check company seeing to raise million ,08:10:06,0.0,1.0,0.0,0.0
2021-02-02,top house democrats are considering a move to strip republican marjorie taylor greene of her two committee assignments if her party will not act on its own ,08:06:02,0.0,0.842,0.158,0.5423
2021-02-02,silver futures opened lower in asia after the cme group announced that it was raising margins for comex contracts ,08:02:04,0.109,0.891,0.0,-0.296
2021-02-02,here is how much investors could have lost in light of robinhood is trading restrictions ,07:59:08,0.141,0.859,0.0,-0.3182
2021-02-02,municipal bond rating downgrades exceeded upgrades last year for the first time since ,07:54:04,0.0,1.0,0.0,0.0
2021-02-02,boris johnson s government is sticking to an election promise not to hike taxes on wages and sales next month ,07:49:06,0.0,0.887,0.113,0.3182
2021-02-02,the cme group is raising margins on comex silver futures by which means those who want to trade will need to put up more collateral ,07:32:07,0.0,0.949,0.051,0.0772
2021-02-02,here is a rundown of your top economic news today ,07:27:02,0.0,0.816,0.184,0.2023
2021-02-02,exxon pledged to spend billion on low emission technologies through after being criticized by activist investors for its environmental record ,07:21:03,0.204,0.796,0.0,-0.5574
2021-02-02,despite a tumble in day trader hero gamestop monday swings narrowed in the broader group of stocks that robinhood hit with trading curbs last week ,07:16:05,0.0,0.865,0.135,0.5574
2021-02-02,the gamestop game has moved on to silver via bopinion,07:10:06,0.0,1.0,0.0,0.0
2021-02-02,south korean traders piled into u s stocks like gamestop and tesla in january driving their buying of overseas equities to a record high ,07:06:04,0.0,0.889,0.111,0.3612
2021-02-02,merrick garland biden is pick for attorney general reports holding shares in companies including procter amp gamble and pfizer ,06:59:06,0.0,0.891,0.109,0.296
2021-02-02,pockets of inflation are flickering across some parts of asia and fading in others impacting central banks scope to further support economies ,06:57:07,0.0,0.886,0.114,0.4019
2021-02-02,johnson amp johnson s one shot covid vaccine appears poised to aid difficult to reach populations that need protection from the virus ,06:52:05,0.106,0.763,0.131,-0.1027
2021-02-02,market volatility in boded well for a canadian hedge fund that pushed its annual gains to ,06:50:03,0.0,0.743,0.257,0.5423
2021-02-02,how china s private refiners upended the oil market ,06:47:06,0.0,1.0,0.0,0.0
2021-02-02,google is shutting down the division of gaming platform stadia that was dedicated to making exclusive games ,06:39:05,0.0,0.769,0.231,0.5423
2021-02-02,biden s administration asks the supreme court to cancel two scheduled arguments over mexican border policies put in place under trump ,06:33:03,0.186,0.672,0.142,-0.0258
2021-02-02,spacex is planning the first all civilian orbital spaceflight later this year and members of the public will be given a chance to snag one of the seats ,06:32:06,0.0,0.929,0.071,0.25
2021-02-02,kroger plans to close two california supermarkets following passage of a local ordinance that requires grocery stores to raise their frontline workers hourly pay by ,06:32:05,0.057,0.943,0.0,-0.1027
2021-02-02,south africa s environmental affairs minister barbara creecy said she rejected pleas for leniency from senior executives at the country s two biggest air polluters ,06:20:08,0.231,0.769,0.0,-0.743
2021-02-02,activist short seller carson block the action in gamestop looks less like a retail trader revolution than a short squeeze by hedge funds targeting other hedge funds ,06:17:03,0.103,0.818,0.079,-0.1761
2021-02-02,thailand s household debt already among the highest in emerging asia is expected to rise further as a fresh covid outbreak curbs incomes ,06:15:14,0.076,0.549,0.375,0.9153
2021-02-02,breaking more americans have received at least one dose of a covid vaccine than have tested positive for the virus an early but hopeful milestone ,06:15:11,0.0,0.765,0.235,0.775
2021-02-02,biden will meet with a group of republican senators at the white house in what could be a make or break moment for his effort to strike a bipartisan relief deal ,06:03:04,0.049,0.85,0.101,0.3818
2021-02-02,dan och has invested in a blank check company that s targeting china s consumer industry ,06:03:03,0.0,1.0,0.0,0.0
2021-02-02,with iron ore at a crossroads investors turn to brazilian producer vale for the final piece of the supply puzzle ,05:58:03,0.0,1.0,0.0,0.0
2021-02-02,a federal watchdog is looking into mnuchin s decision to roll back the fed is emergency lending programs at the end of ,05:51:06,0.12,0.88,0.0,-0.3818
2021-02-02,the biggest knock against investing in silver may be the current reddit driven mania over the precious metal ,05:49:02,0.0,0.821,0.179,0.5719
2021-02-02,robinhood has talked to banks about raising another billion of debt as it tries to keep filling orders fueled by redditors reuters reported ,05:48:06,0.102,0.898,0.0,-0.3612
