date,tweet,time,neg,neu,pos,compound
2021-02-02,aclu elects new york university law professor deborah archer as its first black president ,05:47:04,0.0,1.0,0.0,0.0
2021-02-02,vw chief herbert diess provided an upbeat outlook for the latter half of this year even as covid and a global shortage of semiconductors are poised to crimp the carmaker is first quarter results ,05:44:05,0.057,0.886,0.057,0.0
2021-02-02,the pledge is evolving as new companies sign on ,05:40:08,0.0,1.0,0.0,0.0
2021-02-02,a new senate bill includes a billion program aimed at cities that are considering removing urban freeways and repairing the damage these projects inflicted on vulnerable communities decades ago via citylab,05:33:03,0.159,0.841,0.0,-0.6249
2021-02-02, black panther director ryan coogler has signed a five year deal to create tv shows for disney ,05:32:04,0.0,0.877,0.123,0.2732
2021-02-02,blackstone is buying interior logic group a developer of interior design technology for about billion bolstering its bet on single family housing ,05:30:04,0.0,1.0,0.0,0.0
2021-02-02,the u s treasury scaled back its estimated borrowing needs for the three months through march citing less government spending than expected before the start of the year ,05:26:07,0.0,0.933,0.067,0.2023
2021-02-02,bank of montreal is offering employees three hours of paid time off to receive the covid vaccine when it s available to them ,05:22:05,0.0,1.0,0.0,0.0
2021-02-02,a small canadian silver miner is finding itself on the bright side of reddit induced market chaos just as it seeks to sell stock ,05:19:09,0.374,0.546,0.079,-0.93
2021-02-02,thematic etfs enjoyed their best month on record for inflows led by cathie wood is ark innovation etf adding more than billion ,05:16:05,0.0,0.653,0.347,0.8779
2021-02-02,nomura s former head of non yen rate trading was sued by the cftc for allegedly manipulating the price of u s dollar interest rate swap spreads ,05:13:05,0.091,0.8,0.109,0.128
2021-02-02,mortgage investors enjoyed a robust start to the year thanks in large part to a helpful hand from the federal reserve ,05:06:09,0.0,0.49,0.51,0.9274
2021-02-02,in a move that may help drive down drug costs humana has agreed to buy prescription medicines for some of its members through a purchasing group run by rival cigna ,05:03:03,0.0,0.628,0.372,0.9501
2021-02-02,thousands of u s health care workers are still seeking covid shots even eligibility extends to people far removed from the pandemic s front line ,05:02:04,0.0,0.81,0.19,0.5719
2021-02-02,wheels up which sells flights on private jets is set to become the first operator of business aircraft to trade publicly ,04:54:05,0.0,1.0,0.0,0.0
2021-02-02,this is how the south china sea became a major flashpoint in u s china relations watch in full ,04:51:07,0.0,1.0,0.0,0.0
2021-02-02,the baby boom widely anticipated after pandemic lockdowns took effect has not materialized with five states showing large declines in birth rates ,04:43:04,0.323,0.677,0.0,-0.9186
2021-02-02,questions are flying over what or who is actually behind silver s rally after the original reddit posts that drove it were removed ,04:28:06,0.0,0.901,0.099,0.3182
2021-02-02,george osborne the former u k chancellor of the exchequer is joining the u k takeover advisory boutique robey warshaw a surprise move for the politician turned media and financial executive ,04:28:04,0.0,0.923,0.077,0.2732
2021-02-02,the south african government secured millions of additional vaccines to help bring the pandemic under control and eased a ban on alcohol sales after a two month spike in coronavirus cases abated ,04:25:04,0.097,0.699,0.204,0.4588
2021-02-02,citylab daily the city halls that are anything but mundane via citylab,04:15:03,0.0,1.0,0.0,0.0
2021-02-02,mcdonald s has quietly begun selling the mcplant burger in denmark and sweden ,04:12:05,0.0,1.0,0.0,0.0
2021-02-02,fewer rhinos were killed by poachers in south africa last year as the pandemic reduced incursions into game reserves ,04:05:06,0.2,0.8,0.0,-0.6705
2021-02-02,the eu is trade commissioner urged biden to remove u s duties on european steel and aluminum imposed on controversial national security grounds signaling the bloc would end its retaliatory levies in return ,04:05:06,0.093,0.836,0.072,0.0772
2021-02-02,cantor fitzgerald ceo howard lutnick said that short sellers learned a lesson gamestop but has figured it out and now i think it s good to go ,03:58:12,0.0,0.857,0.143,0.5927
2021-02-02,opec boosted crude production as planned last month but the increase was tempered by disruptions at long troubled member nations according to a bloomberg survey ,03:50:04,0.285,0.573,0.142,-0.6956
2021-02-02,covid deaths have begun to decline in every section of the u s the latest sign of relief as cases continue to drop and the vaccination push accelerates ,03:46:06,0.317,0.602,0.081,-0.9001
2021-02-02,the frenzied trading of gamestop points to policy questions that lawmakers should examine said white house press secretary jen psaki ,03:45:03,0.0,1.0,0.0,0.0
2021-02-02,dustin diamond who played screech on saved by the bell has died of cancer at age ,03:40:18,0.301,0.414,0.286,-0.34
2021-02-02,kosovo became the latest muslim majority country to normalize its relationship with israel ,03:38:07,0.0,1.0,0.0,0.0
2021-02-02,czech billionaire petr kellner s investment company defended the terms for its proposal to take over moneta money bank ,03:37:08,0.0,1.0,0.0,0.0
2021-02-02,a cdc report found that the government lacks data on race and ethnicity for about half of those immunized ,03:37:08,0.0,1.0,0.0,0.0
2021-02-02,billions of dollars fled etfs focused on growth quality and low volatility stocks creating the worst month of flows on record for smart beta products focused on these segments ,03:28:22,0.152,0.538,0.311,0.6705
2021-02-02,uipath an automation software maker has raised funds valuing it at about billion ahead of an ipo ,03:21:06,0.0,0.87,0.13,0.34
2021-02-02,millions of australians may soon get some very uncomfortable news about their retirement nest eggs ,03:21:06,0.171,0.829,0.0,-0.4391
2021-02-02,as many as refugees most from neighboring eritrea are missing after two camps in ethiopia s war torn tigray region were smashed the un said ,03:21:05,0.278,0.722,0.0,-0.7964
2021-02-02,reddit investors rallied around a call to start a biowar on heavily shorted biotech companies ,03:17:05,0.0,1.0,0.0,0.0
2021-02-02,coal is on track to disappear from the u s power grid by morgan stanley says ,03:17:04,0.128,0.872,0.0,-0.2263
2021-02-02,merkel vowed to offer all germans a vaccine by the end of september even if new shots aren t approved ,03:15:49,0.0,0.859,0.141,0.4215
2021-02-02,correct chris lattner president engineering and product of the open source chip startup sifive talks about changes to the industry ,03:08:20,0.0,1.0,0.0,0.0
2021-02-02,lineage logistics one of the world s largest owners of cold storage warehouses spent roughly million to expand further in europe last year ,03:08:05,0.0,0.901,0.099,0.3182
2021-02-02,the silver options market normally a quiet zone compared to gold or oil has burst to life roiled the most in years by the reddit frenzy ,03:07:03,0.087,0.913,0.0,-0.3182
2021-02-02,biden says the u s could reinstate sanctions on myanmar if the military doesn t immediately relinquish the power they have seized in a coup and release activists and officials ,03:05:09,0.0,1.0,0.0,0.0
2021-02-02,redditors raging against financial elites have turned their eye to the silver market but for silver bugs the idea that the establishment is trying to suppress prices is nothing new ,02:48:02,0.071,0.929,0.0,-0.296
2021-02-02,the two lawyers trump hired at the last minute to defend him at his impeachment trial are generally regarded as straight shooters who won t push his wild election fraud claims ,02:37:45,0.104,0.742,0.154,0.2023
2021-02-02,an irish organized crime gang is behind a scheme to forge coronavirus test results for people traveling abroad europol says ,02:29:08,0.163,0.837,0.0,-0.5423
2021-02-02,j amp j will ship some covid vaccines ordered by the eu to the u s for the last stage of production raising concern among some member states of further delays ,02:27:03,0.0,1.0,0.0,0.0
2021-02-02,a renaissance technologies stock fund slumped in january adding to the quant investment giant s woes ,02:25:05,0.182,0.818,0.0,-0.4404
2021-02-02,bp will sell a stake in an omani gas block to thailand s national energy firm for billion ,02:09:10,0.461,0.464,0.075,-0.93
2021-02-02,minneapolis fed president neel kashkari pushed back against the idea that the trading frenzy in gamestop and other hot stocks calls for a monetary policy response ,02:05:26,0.087,0.913,0.0,-0.3182
2021-02-02, given the highly speculative nature of the reddit buzz signal and retail investor behavior in general we recommend using retail participation as a risk factor instead of an alpha signal ,02:03:05,0.065,0.805,0.13,0.2716
2021-02-02,the u s government is investing million to ramp up production from of at home covid tests that don t require a prescription ,02:02:01,0.0,1.0,0.0,0.0
2021-02-02,the gamestop game has moved on to silver ,01:51:06,0.0,1.0,0.0,0.0
2021-02-02,robinhood announced that it has raised an additional billion from existing shareholders on top of the billion it took in last week ,01:48:22,0.0,0.921,0.079,0.2023
2021-02-02,reduced air freight capacity and lockdowns in key european markets threaten to hurt kenyan flower sales for valentine s day ,01:36:09,0.261,0.739,0.0,-0.7184
2021-02-02,ireland says it retains confidence in eu is von der leyen after debacle over vaccines and border checkpoints ,01:27:06,0.0,0.837,0.163,0.5106
2021-02-02,facebook is testing a new full screen prompt for iphone users about its data collection to get ahead of a similar pop up that apple will soon require ,01:26:05,0.0,1.0,0.0,0.0
2021-02-02,truckers are trying to avoid the u k as brexit red tape keeps them waiting hours or more to get to the continent ,01:19:02,0.099,0.901,0.0,-0.296
2021-02-02,long in the works open loop payment systems that let riders use smart cards and mobile devices have found their moment among u s transit agencies via citylab,01:05:02,0.0,0.903,0.097,0.4019
2021-02-02,risks related to climate change and social issues will intensify the most in the next two years finance executives say in a new survey ,01:03:05,0.087,0.913,0.0,-0.2732
2021-02-02,the design of some of america is more interesting city halls can tell us a lot about their cities at the time of construction via citylab,00:50:07,0.0,0.889,0.111,0.4576
2021-02-02,robinhood pared back trading curbs imposed last week in the face of a reddit fueled market frenzy but that hasn t quelled customers suspicions of its motives ,00:44:44,0.216,0.784,0.0,-0.6187
2021-02-02,a democratic led house panel is launching a probe into coronavirus outbreaks at meatpacking plants and whether osha adequately enforced worker safety rules ,00:40:25,0.0,0.877,0.123,0.4215
2021-02-02,short interest in gamestop plummeted to of free floating shares from in mid january ,00:28:04,0.0,0.564,0.436,0.8176
2021-02-02,philippines is negotiating for million coronavirus vaccine doses and will prioritize its healthcare workers and uniformed personnel ,00:28:04,0.0,1.0,0.0,0.0
2021-02-02,the surging price of silver threatens to boost costs for solar panel producers which account for about of global demand for the metal ,00:27:53,0.153,0.746,0.101,-0.1027
2021-02-02,the ism gauge of factory activity eased to a still elevated in january from a month earlier ,00:26:04,0.0,0.864,0.136,0.296
2021-02-02,there s a record amount of office space available in manhattan ,00:26:04,0.0,1.0,0.0,0.0
2021-02-02,cbo says it sees the u s economy recovering from the coronavirus pandemic much faster than previously expected ,00:21:53,0.0,1.0,0.0,0.0
2021-02-02,gamestop tumbled as much as as bearish investors appeared to cover their positions while retail traders flocked to other corners of the market ,00:13:12,0.0,1.0,0.0,0.0
2021-02-02,tony bennett has been diagnosed with alzheimer s disease but it has not quieted his legendary voice ,00:10:03,0.0,1.0,0.0,0.0
2021-02-02,why the reddit army bailout is the kind of rescue that the most indebted u s firms can only dream of ,00:09:06,0.062,0.714,0.223,0.5584
2021-02-02,england will start mass testing for the south africa coronavirus variant in some areas after cases were found with no links to travel ,00:05:08,0.091,0.909,0.0,-0.296
2021-02-01,japanese prime minister yoshihide suga is set to announce a month long extension of the country s state of emergency ,23:51:05,0.133,0.867,0.0,-0.3818
2021-02-01,india is mammoth spending plan of almost billion is expected to jump start growth but may not be enough to tackle rising unemployment and poverty ,23:36:04,0.259,0.685,0.056,-0.8176
2021-02-01,jetblue to offer private studio suites with sliding doors as it remodels its premium cabin for upcoming flights to london ,23:34:06,0.0,1.0,0.0,0.0
2021-02-01,apple is selling bonds just days after a blowout period for sales still eager to take advantage of cheap borrowing costs amid a cautious earnings outlook ,23:33:03,0.052,0.781,0.167,0.4767
2021-02-01, the gop proposal includes in direct payments vs proposed by biden direct covid related spending amounts to b b is reserved for unemployment benefits the gop plan extends the supplemental payments to june more ,23:26:18,0.081,0.806,0.114,0.0516
2021-02-01,south african president cyril ramaphosa is likely to announce lifting the ban on alcohol sales as covid infections decline ,23:26:05,0.444,0.556,0.0,-0.9485
2021-02-01,european commission president ursula von der leyen blames a humiliating u turn over vaccine export controls on one of her deputies responsible for the controversial regulation ,23:21:05,0.231,0.69,0.079,-0.5267
2021-02-01,tesla is stock fireworks aren t over one analyst predicts ,23:21:04,0.0,1.0,0.0,0.0
2021-02-01,new a group of republicans pitch their alternative covid relief plan to the white house today ,23:20:23,0.0,0.819,0.181,0.4767
2021-02-01,this is how the south china sea became a major flashpoint in u s china relations watch in full ,23:14:05,0.0,1.0,0.0,0.0
2021-02-01,this is how the south china sea became a major flashpoint in u s china relations watch in full ,23:14:05,0.0,1.0,0.0,0.0
2021-02-01,the world s biggest economies are falling behind on commitments to cut greenhouse gases fast enough to limit global warming ,23:13:04,0.17,0.688,0.142,-0.1531
2021-02-01,reddit army helps silver spike army takes power in myanmar and oil is big week ahead here is what is moving markets ,23:09:11,0.0,0.89,0.11,0.3818
2021-02-01,the blank check company craze that s taken wall street by storm is now spreading to asia ,23:08:02,0.096,0.904,0.0,-0.1531
2021-02-01,silver spiked past as the metal took center stage in the retail investor frenzy sweeping through markets ,23:07:22,0.126,0.874,0.0,-0.3182
2021-02-01,gamestop shares are ,23:05:02,0.0,0.476,0.524,0.296
2021-02-01,tilman fertitta is taking his restaurant and casino empire public again through a merger with a special purpose acquisition company that values his company at billion ,23:03:07,0.0,0.803,0.197,0.6597
2021-02-01,with new york state close to legalizing marijuana a fight is brewing over how to spend what could be more than million in annual tax revenue ,23:02:03,0.098,0.902,0.0,-0.3818
2021-02-01,the loneliness of the right winger an interview with noreena hertz author of the lonely century how to restore human connection in a world that is pulling apart via bw,22:59:06,0.158,0.776,0.066,-0.4767
2021-02-01,india the world is biggest cotton grower imposes a import tax on the fiber to help farmers ,22:54:07,0.077,0.773,0.149,0.3182
2021-02-01,russian prosecutors demand opposition leader alexey navalny is imprisonment ,22:54:06,0.158,0.842,0.0,-0.128
2021-02-01,millennials have emerged as a potent force in luxury real estate during covid ,22:52:04,0.0,1.0,0.0,0.0
2021-02-01,goldman asked some of its most in demand traders to sign a six month non compete clause to get bonuses for the breakout year ,22:50:06,0.067,0.796,0.136,0.4256
2021-02-01,brailian legislators will choose the heads of both the lower house and the senate in a defining moment for president jair bolsonaro ,22:30:09,0.099,0.901,0.0,-0.296
2021-02-01,president biden now faces a foreign policy crisis in myanmar ,22:20:06,0.339,0.661,0.0,-0.6249
2021-02-01,elon musk makes his debut on the invite only clubhouse app with talk ranging from bitcoin to monkey brains ,22:13:08,0.0,0.918,0.082,0.1531
2021-02-01,new york city is bracing for as much as inches of snow ,22:12:47,0.0,1.0,0.0,0.0
2021-02-01,thousands of u s health care workers are still seeking covid shots even eligibility extends to people far removed from the pandemic s front line ,22:02:02,0.0,0.81,0.19,0.5719
2021-02-01,workers at amazon is facility in bessemer alabama are being pulled into mandatory anti union presentations ahead of a key vote ,22:01:01,0.103,0.762,0.135,-0.0772
2021-02-01,even within president biden s white house there s debate about how to meet his promise to issue americans another each in stimulus checks ,22:00:08,0.0,0.901,0.099,0.3182
2021-02-01,the u k believes it s too early to talk about sharing vaccine doses with other countries boris johnson s spokesman tells reporters ,21:51:23,0.0,0.865,0.135,0.4215
2021-02-01,looming approvals of new shots raises the possibility of choice which vaccine do you want ,21:51:19,0.095,0.823,0.082,-0.0516
2021-02-01,a decade after myanmar s highly praised opening to the outside world following decades of military rule the armed forces are back in power ,21:31:08,0.0,0.857,0.143,0.5413
2021-02-01,the adverse impact of leaving the single market and customs union is seeping into the u k economy in ways that are hard to see ,21:22:08,0.157,0.843,0.0,-0.4404
2021-02-01,cash out now or stick with stocks such as gme and amc that is the question facing reddit market winners this week ,21:18:06,0.0,0.871,0.129,0.4767
2021-02-01,india increases its defense spending by about even as it faces a protracted standoff with china along their disputed himalayan border ,21:11:07,0.078,0.55,0.372,0.9022
2021-02-01,a new series by bloomberg green looks at benchmarks to gauge if countries are on track to meet their net zero emissions goals ,21:08:02,0.0,1.0,0.0,0.0
2021-02-01,india plans to spend billion to revive loss making electricity distributors after an earlier program failed to make them profitable ,21:07:07,0.384,0.462,0.153,-0.9001
2021-02-01,with a possible ipo near the gamestop affair is putting robinhood under a starker light ,21:06:05,0.0,1.0,0.0,0.0
2021-02-01,president biden is trade strategy is starting to take shape and it looks a lot different from donald trump is ,21:04:02,0.0,1.0,0.0,0.0
2021-02-01,here is a rundown of your top economic news today ,21:03:06,0.0,0.816,0.184,0.2023
2021-02-01,more than countries have pledged to get to net zero emissions in the next years where do they stand now here is the latest ,21:03:06,0.0,1.0,0.0,0.0
2021-02-01,the game developer behind hero wars and throne rush nexters global is going public through a deal with a blank check company started by former megafon head ivan tavrin sources say ,20:59:02,0.105,0.789,0.105,0.0
2021-02-01,uganda is opposition leader bobi wine challenges election result in court alleging irregularities ,20:50:07,0.0,0.902,0.098,0.0772
2021-02-01,horizon therapeutics plans to buy viela bio for about billion to gain experimental treatments for rare diseases ,20:44:06,0.0,0.429,0.571,0.9776
2021-02-01,elon musk tells people on clubhouse that he is wired up a monkey is brain to play video games he is a happy monkey musk says ,20:43:05,0.0,0.783,0.217,0.7269
2021-02-01,julius baer ceo philipp rickenbacher hints the swiss bank could seek a big deal ,20:28:03,0.0,1.0,0.0,0.0
2021-02-01,india is government is increasingly tapping citizens small savings to fund budget plans ,20:28:03,0.0,1.0,0.0,0.0
2021-02-01,february looks to be another busy month for london ipos ,20:16:05,0.0,1.0,0.0,0.0
2021-02-01,britain has committed to a reduction in emissions by compared to here s why heat pumps are crucial to meeting that goal ,20:16:04,0.0,0.9,0.1,0.2732
2021-02-01,by seizing power myanmar s generals are providing joe biden with an early test of his efforts to counter the appeal of china s governance model in asia ,20:14:05,0.0,1.0,0.0,0.0
2021-02-01,elon musk says tesla s battery suppliers need to increase their production of battery cells ,20:13:06,0.0,0.85,0.15,0.3182
2021-02-01,the battle between retail traders and hedge funds is unlikely to cause a major setback for markets jpmorgan strategists say ,20:12:03,0.126,0.874,0.0,-0.3818
2021-02-01,sequoia capital and singapore is gic are buying into tpg backed australian clinical testing firm novotech at a valuation of over billion ,19:52:02,0.0,0.948,0.052,0.0258
2021-02-01,u k mortgage approvals hold near a decade high ,19:47:03,0.0,1.0,0.0,0.0
2021-02-01,india cut an import tax on gold to curb record high prices and inflows of illegal supplies ,19:32:04,0.275,0.725,0.0,-0.6908
2021-02-01,institutional investors are buying kuaishou is hong kong shares before its friday debut at a premium of double the listing price ,19:27:50,0.0,0.896,0.104,0.296
2021-02-01,hedge fund greylock capital associates files for bankruptcy proceedings in new york ,19:07:43,0.0,1.0,0.0,0.0
2021-02-01,israel extends the country s third lockdown for five more days as more infectious virus variants overwhelm hospitals ,18:46:26,0.093,0.824,0.082,-0.0516
2021-02-01,india will more than double its health spending after struggling to manage the world s second largest outbreak of covid ,18:22:45,0.135,0.865,0.0,-0.4215
2021-02-01,bayer agreed to produce curevac s experimental coronavirus vaccine to help speed the rollout of a promising shot ,18:02:02,0.0,0.634,0.366,0.7579
2021-02-01,these are the winners and losers from india is pandemic budget ,18:00:14,0.219,0.581,0.2,-0.0772
2021-02-01,hsbc will establish an office to spearhead its strategy in china s fast growing greater bay area ,17:56:05,0.0,0.769,0.231,0.4939
2021-02-01,india the world is biggest cotton grower imposes a import tax on the fiber to help farmers ,17:54:04,0.077,0.773,0.149,0.3182
2021-02-01,russian prosecutors demand opposition leader alexey navalny is imprisonment ,17:54:03,0.158,0.842,0.0,-0.128
2021-02-01,former south african president jacob zuma says he will refuse to cooperate with a judicial panel that is probing graft during his nine year rule ,17:54:03,0.087,0.913,0.0,-0.296
2021-02-01,saudi arabia is wealth fund plans to establish an airline company in collaboration with other investment entities the online maaal newspaper reports ,17:53:02,0.0,0.868,0.132,0.4939
2021-02-01,the eu seeks to overturn apple is victory in a billion tax dispute ,17:53:02,0.197,0.803,0.0,-0.4019
2021-02-01,millennials have emerged as a potent force in luxury real estate during covid ,17:52:03,0.0,1.0,0.0,0.0
2021-02-01,indian firms are returning to the lng spot market as prices for the fuel recede from record highs ,17:50:10,0.0,1.0,0.0,0.0
2021-02-01,hartree partners forms a joint partnership to develop solar projects across the u k and continental europe that could attract billion of outside investment ,17:50:10,0.0,0.889,0.111,0.3612
2021-02-01,india will set up a company to manage bad debt for banks which is expected to reach record levels this year ,17:50:10,0.249,0.705,0.046,-0.7096
2021-02-01,india plans to provide more farm loans in the year starting in april to ease farmers financial stress and boost agricultural production ,17:49:05,0.104,0.704,0.193,0.34
2021-02-01,china focused private equity firm zq capital sold a u s medical device manufacturer to buyout firm gtcr for about million including debt according to sources ,17:48:05,0.096,0.805,0.1,0.0258
2021-02-01,with their makeshift sewage systems and terrible ventilation hong kong is notorious coffin homes are sparking a covid surge via citylab,17:47:03,0.25,0.75,0.0,-0.7184
2021-02-01,reddit favorites gamestop and amc entertainment hold onto gains ,17:47:03,0.0,0.429,0.571,0.7906
2021-02-01,italian manufacturing is picking up at the fastest pace in nearly three years a bright spot in an economy that probably shrank close to during the pandemic ,17:44:05,0.0,0.896,0.104,0.4404
2021-02-01,u s president joe biden s climate envoy john kerry aims to work with the uae as he leans on major fossil fuel producers to lower their greenhouse gas emissions ,17:43:06,0.078,0.922,0.0,-0.296
2021-02-01,nextenergy renewables plans to raise million in an initial public offering in london ,17:43:06,0.0,1.0,0.0,0.0
2021-02-01,the semiconductor industry grew in fueled by demand for technology to support work and study from home in the pandemic ,17:38:01,0.068,0.811,0.122,0.296
2021-02-01,hong kong insurance giant aia group and china strategic holdings an investment firm backed by billionaire henry cheng are among final bidders for bank of east asia s life insurance unit sources say ,17:37:06,0.0,0.966,0.034,0.0258
2021-02-01,myanmar is military has reportedly taken over after detaining suu kyi and other leaders click the follow button to get the latest updates as the crisis unfolds ,17:37:05,0.136,0.864,0.0,-0.6249
2021-02-01,ken griffin s citadel is once again at the center of a wallstreetbets drama this time over the firm s holdings of silver ,17:34:05,0.0,1.0,0.0,0.0
2021-02-01,the u s and iran are calling on each other to take the first step to restore the international nuclear deal ,17:30:10,0.0,0.891,0.109,0.296
2021-02-01,the u k government ordered million extra doses of an experimental coronavirus shot from french vaccine developer valneva ,17:15:05,0.0,1.0,0.0,0.0
